complaint_id,product,sub_product,issue,sub_issue,company,state,channel,timely_response,consumer_disputed,date_received,compliance_signal,narrative_length,narrative_preview
3573294,"Credit reporting, credit repair services, or other personal consumer reports",Credit reporting,Incorrect information on your report,Information belongs to someone else,"EQUIFAX, INC.",NC,Web,Yes,N/A,2020-03-19,legal_risk,1139,"I wrote three requests, the unverified accounts listed below still remain on my credit report in violation of Federal Law. Equifax is under FCRA law to obtain the of the original creditors documentation on file to verify that this information is mine and is correct. I have already filed a FTC Report and Police Report. Who verified these accounts? You have NOT provided me a copy of ANY original documentation ( a consumer contract with my signature on it ) as required under Section 609 ( a ) ( 1 ) ( A ) & Section 611 ( a ) ( 1 ) ( A ). Furthermore you have failed to provide the method of verification as required under Section 611 ( a ) ( 7 ). Please be advised that under Section 611 ( 5 ) ( A ) of the FCRA you are required to promptly DELETE all information which can not be verified. 
The law is very clear as to the Civil liability and the remedy available to me ( Section 616 & 617 ) if you fail to comply with Federal Law. I am a litigious consumer and fully intend on pursuing litigation in this matter to enforce my rights under the FCRA. Please remove the following accounts : XXXX XXXX XXXX XXXX XXXX, XXXX XXXX XXXX   XXXX"
3300820,Credit card or prepaid card,Store credit card,Problem with a purchase shown on your statement,Card was charged for something you did not purchase with the card,Nelson Cruz & Associates LLC,TN,Web,Yes,N/A,2019-07-09,legal_risk,895,"On XX/XX/XXXX I was called by a creditor Nelson Cruz and Associate they claimed I owed XXXX XXXX XXXX XXXX {$12000.00} from XXXX thru XXXX ... I never had a credit card with XXXX or applied for credit with them ... On XX/XX/XXXX I called XXXX XXXX XXXX XXXX and spoke in someone in customer service along Security and Fraud Dept. I gave them my personal info SS #, DOB, address and they did not have me in there records.. 
I called XXXX, XXXX  and XXXX I ordered my credit report and XXXX XXXX XXXXXXXX XXXX XXXX not on my credit report ... 
Nelson Cruz and Associate will not give me the bill from XXXX XXXX instead they want to settle for {$4000.00} over the phone, They continue to harass me with threats, arrest, lawsuit, vehicle repossession, wage garnishments ect.. 
Here are the name and phone.. 

Nelson Cruz and Associate XXXX XXXX XXXX. XXXX, Tx XXXX phone XXXX or XXXX 
XXXX XXXX XXXX"
8070648,Debt collection,Credit card debt,False statements or representation,Attempted to collect wrong amount,Resurgent Capital Services L.P.,KY,Web,Yes,N/A,2023-12-28,legal_risk,258,"XXXX 2021, amount of XXXX to collect is Not accurate on my credit report. 
*I had called the company was told I had a lawsuit on me to pay the debt and that amount is not right! 
* So the rep told me to email for correspondence an I have gotten no reply back"
3486993,"Money transfer, virtual currency, or money service",Mobile or digital wallet,Fraud or scam,,"Block, Inc.",FL,Web,Yes,N/A,2020-01-06,legal_risk,1690,"According to Federal Law, XXXX is legal. I opened an online business. I used Square as my vehicle of payment. After 2 sales totaling {$950.00}, they deactivated my account saying it was a high risk business. I understand, XXXX is still misunderstood, but it helps millions of people deal with pain & anxiety. So I am passionate about helping people feel better. If Square doesn't understand that it is legal, that it is NOT trying to hurt the public ( quite the opposite ) & they consider it high risk, fine. But don't keep my money for 3 months with NO resolve ability. It is impossible to reach them. OH yes, sales you get a human. Anything involving a deactivated account, they tell you to look at the first email. I called their numbers ( 3 of them ) on 5 different occasions over the past 2 months, all lead you to nowhere but frustration. That email tells you to go to their help online. Help online tells you to go to the email. 
Contacted the sales rep I bought it from on XX/XX/XXXX. When deactivated, I sent him an email on XX/XX/XXXX. No response. I called him on XX/XX/10, XXXX. No call back. I am beyond words. 

On XX/XX/XXXX, XXXX XXXX attempted to transfer to my XXXX XXXX account. On"
3401796,Debt collection,Mortgage debt,Communication tactics,"You told them to stop contacting you, but they keep trying","SELECT PORTFOLIO SERVICING, INC.",VA,Web,Yes,N/A,2019-10-10,legal_risk,737,"SPS Select Portfolio Servicing of XXXX XXXX XXXX, UT appears to be a debt collection agency, who started a systematic harassment by mail debt collection campaign against wife, XXXX XXXX. 

This harassment following a failed foreclosure attempt over the past 2 years ( XXXX-XXXX ) by XXXX XXXX XXXX and their attorneys ( XXXX ) over a 2nd Mortgage default loan by XXXX, approximately 10 Years ago. 

During XXXX-XXXX time period of XXXX/XXXX ( attempt to foreclose on our residence, XXXX XXXX XXXX, XXXX, VA XXXX, on legal advice & assistance of Mr. XXXX XXXX, Attorney, XXXX XXXX, VA, both myself, XXXX XXXX, and wife, XXXX, entered Chapter XXXX Trustee Protection, twice, that prevented the foreclosure attempt by XXXX/XXXX legal agent."
3358661,"Credit reporting, credit repair services, or other personal consumer reports",Credit reporting,Problem with a credit reporting company's investigation into an existing problem,Their investigation did not fix an error on your report,"MARINER FINANCE, LLC",MS,Web,Yes,N/A,2019-08-29,legal_risk,2342,"On XX/XX/XXXX, I received a personal loan from the XXXX XXXX, XXXX branch of XXXX XXXX XXXX. On XX/XX/XXXX, my wife and I filed Chapter XXXX Bankruptcy which included that loan. The bankruptcy was completed on XX/XX/XXXX, and the loan is being properly listed on my credit report as Chapter XXXX Bankruptcy. 

However there is another loan listed on my credit report under Mariner Finance. It was also reportedly issued on XX/XX/XXXX, with a last payment made date of XX/XX/XXXX, the exact dates reported by XXXX XXXX XXXX. This loan is being reported as Unpaid Balance Charged Off. I have never applied for or received a loan from Mariner Finance, and certainly did not apply for or receive two entirely different loans on XX/XX/XXXX, as is currently claimed on my credit report. 

In XX/XX/XXXX, XXXX XXXX XXXX merged with Mariner Finance , LLC and on XX/XX/XXXX, the company became known as Mariner Finance. It appears that sometime between the merger and the final discharge of the debt, the account was transferred from XXXX XXXX XXXX to Mariner Finance, resulting in a new account number. That doesn't make it a new loan or change the fact it was XXXX, however. 

On XX/XX/XXXX, I submitted an "
3063440,"Payday loan, title loan, or personal loan",Payday loan,Problem with a credit reporting company's investigation into an existing problem,Their investigation did not fix an error on your report,Ad Astra Recovery Services Inc,TX,Web,Yes,N/A,2018-11-01,legal_risk,845,"On XX/XX/18, I filed a complaint with Consumer Finance Protection Bureau ; XXXX ( complaint number ), regarding "" Ad Astra Recovery Service '', falsifying information on my credit report that they never "" Validated '' as belonging to me. In their response to the Consumer Finance Protection Bureau, on XX/XX/18 ; Ad Astra Recovery Service, stated they requested to the bureaus to delete from my credit report. They  never deleted this account from my XXXX credit report. This continue to be a "" Fraudulent '' company. I have attached the XXXX  report showing they are telling XXXX to keep this false information on my credit report illegally, according to the "" Fair Debt Collections Practices Act ''. I am requesting to have this information forwarded to "" the Attorney General 's Office, and to forward to Federal Trade Commission immediately."
3220066,Debt collection,Payday loan debt,Attempts to collect debt not owed,Debt was result of identity theft,"National Credit Adjusters, LLC",TX,Web,Yes,N/A,2019-04-23,legal_risk,313,National credit adjusters after giving then police reports and ftc identify theft report put a collection on my XXXX  report that legally needs to be removed.this is illegally on my XXXX credit report. My ss # is XXXX.I have given proof of this to my attorney who has taken several companies to court on my behalf
3115907,Mortgage,FHA mortgage,Closing on a mortgage,,Selene Finance LP,GA,Web,Yes,N/A,2019-01-03,legal_risk,397,"I closed out my mortgage loan with Selene Finance when I sold my former house on XX/XX/2018. I was told by the closing attorney that Selene Finance would send me a check for the excess money in my escrow account within 20 days of closing. Selene Finance has confirmed that there was approximately {$4000.00} in my account but they have not sent it to me, despite numerous attempts to contact them."
7942358,Credit card,General-purpose credit card or charge card,Problem with a purchase shown on your statement,Card was charged for something you did not purchase with the card,WELLS FARGO & COMPANY,AZ,Web,Yes,N/A,2023-12-04,legal_risk,399,"I have been having ongoing problems with my credit cards at Wells Fargo. Cards not being sent to right address, fraudulent charges, etc. 

This past XXXX and XXXX, my card was charged for XXXX at XXXX, and then XXXX for XXXX, XXXX, and XXXX. I have had no luck contacting any of the businesses due to "" privacy concerns ''. I have filed a police report and have asked Wells Fargo to reopen the case."
3493072,"Money transfer, virtual currency, or money service",Domestic (US) money transfer,Other transaction problem,,"BANK OF AMERICA, NATIONAL ASSOCIATION",MD,Web,Yes,N/A,2020-01-11,legal_risk,647,"On XX/XX/2019, I was threatened to make a wire transfer in the amount of {$26000.00} from my bank account ( Bank : Bank of America ) to a fraud person claiming to be a social security agent. I filed a claim with the bank but it did nothing to help me receive my money back. I also filed a police complaint but even the police put up their hands. The Police report # is the following : XXXX. I request to please help me with this matter. That honest, hard-earned money was going to be used for a significant life goal I was trying to accomplish. I would really appreciate any help I can get. The bank is inefficient at this point in doing anything."
3233732,"Credit reporting, credit repair services, or other personal consumer reports",Credit reporting,Problem with a credit reporting company's investigation into an existing problem,Difficulty submitting a dispute or getting information about a dispute over the phone,"TRANSUNION INTERMEDIATE HOLDINGS, INC.",FL,Web,Yes,N/A,2019-05-06,legal_risk,853,"I had my identity stolen in XX/XX/XXXX. The thieves opened 2 credit line accounts with XXXX XXXX. I found out in XX/XX/XXXX. Had a police report made and notified the the 3 Credit Bureaus. All of them is such a difficult thing to get help. almost impossible. The websites aren't clear as to what to do. The numbers they provide are not right, as they are automated and no way to speak to a person. In special with XXXX, I filed a dispute, notified them of the identity theft back in XX/XX/XXXX, printed a report with the information and as of today, XX/XX/XXXX my credit is still showing the derogatory information. 
It is absurd what a person has to go through after being victimized by thieves. Something needs to be done about these companies. Trans Union is the same thing. I notified the 3 of the fraud, yet, I had to spend the day talking to them."
3244458,Mortgage,Conventional home mortgage,Trouble during payment process,,"CARRINGTON MORTGAGE SERVICES, LLC",NY,Web,Yes,N/A,2019-05-16,legal_risk,410,"This is in reference to COMPLAINT ID XXXX SUBMITTED ON XX/XX/XXXX Concerning Carrington 's  mismanagement of resolving mortgage assignments and recordings for a partial lien release. The closing for the property was to be XX/XX/XXXX. Because of the delay the buyer backed out of the sale of the vacant lot, {$35000.00}. My attorney did not receive the paperwork releasing the lien until XXXX of XXXX. XXXX XXXX"
8027980,Debt collection,I do not know,Electronic communications,"You told them to stop contacting you, but they keep trying",Imperial Finance Corp,IN,Web,Yes,N/A,2023-12-19,legal_risk,828,"XXXX XXXX from Imperial Finance Corp has been attempting to contact me and my wife for a made-up debt of over {$55000.00}. I have been called, texted, and emailed repeatedly. 
XXXX of the emails had several other unknown personal email addresses copied. They are spamming random people over this. 

The website ( IMPERIALFINANCECORP.COM ) appears to have only existed since XX/XX/2023. The website is highly suspicious and contains very little information, and only XXXX way to contact "" them '' by email at XXXX There also appears to be no legal business registration or location. 

They are using many invasive tactics, calling and texting outside of normal business hours, repeatedly calling and have not stopped when asked to do so. 

The fact they are also calling my wife attempting to "" look for me '' is also concerning."
6305546,"Credit reporting, credit repair services, or other personal consumer reports",Credit reporting,Problem with a credit reporting company's investigation into an existing problem,Was not notified of investigation status or results,Experian Information Solutions Inc.,,Web,Yes,N/A,2022-12-10,legal_risk,803,A few weeks ago I sent letters to all XXXX credit bureaus regarding some items on my credit report which I know are not accurate which is a violation of the FCRA and FDCPA and you must abide by the law. Everything I have provided in my letters is true and accurate to my knowledge. Ive received emails and letters saying Im using a 3rd party which is incorrect because I am the one sending my letters out and filing this complaint with no help from a credit repair company or 3rd party. The CRAs are in violation of my rights due to not providing a notice of dispute and for failure to communicate to me that I disputed stuff on my credit. I request these accounts to be deleted from my credit asap or I will take legal action and hire a lawyer. I want to purchase a house soon and this holding me back.
8131360,Credit reporting or other personal consumer reports,Credit reporting,Problem with a company's investigation into an existing problem,Their investigation did not fix an error on your report,"CAINE & WEINER COMPANY, INC.",TX,Web,Yes,N/A,2024-01-09,legal_risk,1212,"This is regarding complaint XXXX. The original creditor was contacted and could not furnish information being alleged by the collection agency Caine & Weiner. Furthermore, I received no communication by mail leading up to the reporting of this collection account. This account was added to my records in XX/XX/XXXX. Also, I formally requested a copy of the correspondence that was supposedly mailed to me during that time informing me of this debt with your company, the forward flow agreement, the contract bearing my signature, and your license to collect debt in the state of TX. I submitted the aforementioned account in XX/XX/XXXX. It is now XX/XX/XXXX and you have failed to provide any of the requested information to support your claim. Failure to provide this documentation constitutes yet another violation under the FDCPA, which entitles me to seek {$1000.00} per violation. It is also important to note that my information was involved in XXXX XXXX data breach in which I will provide my claim Id as I did before. Remove this account from my credit report immediately or I will proceed with legal action being that I have given your company ample amount of time to fix this error. CAINE &"
8253290,Credit reporting or other personal consumer reports,Credit reporting,Problem with a company's investigation into an existing problem,Investigation took more than 30 days,Experian Information Solutions Inc.,CA,Web,Yes,N/A,2024-01-30,legal_risk,841,"I lodged a complaint with these Bureaus a month ago, but unfortunately, the inaccurate information on my report still remains. I haven't received any communication from the Bureaus, except for the notification that you sent stating that the company has responded to my complaint. How can I be certain that they have thoroughly checked the inaccuracies on my report? What methods did they employ to validate the accounts? This whole situation is incredibly frustrating! It's been more than 30 days since I filed a complaint with these Bureaus, and yet the disputed accounts have not been updated. If this continues, I will have no choice but to take legal action due to the immense stress this has caused me. Moreover, I am also concerned about the security of my personal data, as it was affected by the XXXX, Experian, and XXXX data breach."
8216921,Credit reporting or other personal consumer reports,Credit reporting,Incorrect information on your report,Information belongs to someone else,Experian Information Solutions Inc.,PA,Web,Yes,N/A,2024-01-24,legal_risk,1723,"I, XXXX XXXX XXXX XXXX, am a natural living person. I am writing to dispute certain information present on my credit report, which I believe is inaccurate. This dispute is based on the provisions outlined in the Fair Credit Reporting Act, including 15 U.S. Code 1681a, 15 U.S. Code 1681s-2, and 15 USC 1681a 2 ( A ) ( i ).

According to 15 U.S. Code 1681a, the definition of a consumer report excludes reports containing information solely as to transactions or experiences between the consumer and the reporting entity. It is evident that the information in dispute falls under this exclusion.

Furthermore, 15 U.S. Code 1681s-2 emphasizes the responsibility of furnishers of information to consumer reporting agencies. The law stipulates that furnishers must provide accurate information and prohibits reporting with actual knowledge of errors.

In addition, 15 USC 1681a 2 ( A ) ( i ) supports my claim by specifying exclusions from the definition of a consumer report, highlighting the relevance of the disputed information to this exclusion.

I am also placing a FTC reference number- XXXX XXXX  so that you can verify the inaccuracy of fraud that is placed on my credit report.

Now based on th"
3673848,"Credit reporting, credit repair services, or other personal consumer reports",Credit reporting,Incorrect information on your report,Information belongs to someone else,Experian Information Solutions Inc.,TX,Web,Yes,N/A,2020-05-29,legal_risk,146,SHOWING A LATE ON MORTGAGE FCRA VIOLATIONS IF IT CANT BE CORRECTED MUST BE REMOVED FTC VIOLATIONS XXXX  XXXX XXXX XXXX   VIOLATIONS FILED AND SENT
7985106,Checking or savings account,Checking account,Managing an account,Deposits and withdrawals,FIFTH THIRD FINANCIAL CORPORATION,FL,Web,Yes,N/A,2023-12-11,legal_risk,1618,"I opened an Account with fifth third bank on XXXX XXXX. I tried to change my direct deposit to the new bank account. My payroll department had not yet verified the bank by the date my payroll check should have been released so I received a "" Live Check '' I went to the branch located at XXXX XXXX XXXX XXXX XXXX XXXX, XXXX, FL XXXX. The check amount was XXXX. I spoke with a teller, whom was extremely rude to begin with. She proceeded to deposit the check without informing me that there policy states that new deposits are subject to a hold. Had I been informed I would have taken the check to The issuing bank and cashed it. Now after speaking with the branch manager he informed me that the hold will not be removed until XX/XX/23. I was under the impression that Federal law states that XXXX should be released on the account within 24 hrs. until the hold is released. I am not able to access said funds still. I spoke with XXXX who is a supervisor at the customer service center. She informed me that funds should be available Saturday XX/XX/23 and they have no way of accessing the XXXX. I was under the impression that with payroll checks this is FEDERAL LAW. I am now in a situation where m"
3693066,"Credit reporting, credit repair services, or other personal consumer reports",Credit reporting,Problem with a credit reporting company's investigation into an existing problem,Was not notified of investigation status or results,"EQUIFAX, INC.",TX,Web,Yes,N/A,2020-06-10,legal_risk,678,"I was trying to cosign for my mom a vehicle, and the car salesman told me my credit was low. I told him to show me my report and print me out a copy. There are items on my credit that needs to be removed as soon as possible. These items are fraudulent accounts/items. XXXX XXXX XXXX. Credit Inquiries : XXXX XXXX XXXX XXXX XXXX XXXX XXXX XXXX XXXX XXXX XXXX XXXX XXXX XXXX XXXX XXXX XXXX XXXX XXXX XXXX XXXX XXXX XXXX XXXX XXXX XXXX XXXX XXXX XXXX XXXX XXXX XXXX XXXX XXXX XXXX XXXX XXXX XXXX XXXX XXXX XXXX XXXX XXXX XXXX XXXX XXXX XXXX XXXX XXXX XXXX XXXX 

I have contacted the FTC and my local police and I am doing this on my own behalf. Please remove these from my report."
8039497,Mortgage,FHA mortgage,Trouble during payment process,Trying to communicate with the company to fix an issue while managing or servicing your loan,COLORADO HOUSING AND FINANCE AUTHORITY,CO,Web,Yes,N/A,2023-12-22,legal_risk,2263,"I started investigating my mortgage in XXXX, by XX/XX/XXXX I suspected that this was a fraudulent transaction and started by sending refuse for cause without dishonor their requests for payment and inquiring about the details of this particular transaction. I was met with my questions being avoided and lack of meaningful response every time. It didn't appear that GAAP accounting was adhered to, and I suspected the accounting to be falsified. I later discovered that my Note funded the transaction and I wasn't given full disclosure. After trying to get answers that were never answered, I was met with a lawsuit from the opposing party 's debt collection attorneys at XXXX XXXX XXXX XXXX XXXX XXXX XXXX XXXX XXXX XXXX XXXX who I believe is guilty of identity theft by using my private data and placing on the public record for unjust enrichment without having standing to do so and who had Never after multiple requests proved their authority to do what they've done. I submitted a complaint to the CFPB back in XXXX and I didn't receive a valid response to my complaint. All the company did was avoid my complaint and say they referred me to their attorneys back in XXXX of XXXX and they followe"
3445015,Mortgage,Conventional home mortgage,Trouble during payment process,,Ditech Financial LLC,SC,Web,Yes,N/A,2019-11-20,legal_risk,4815,"In XXXX, I owed {$38000.00} on my house when I left chapter XXXX bankruptcy. Under advice of my attorney, I did not reaffirm the loan due to house not being worth the loan value. Over the next couple of years, I tried to negotiate with XXXX  XXXX XXXX to keep my house. I filled out several loan modification applications and submitted them to the bank. In XXXX, I hired an attorney to assist with the loan modification process because of their constantly making me redo the application. That same year XXXX  XXXX XXXX foreclosed on my property and during the foreclosure they transferred the loan to Green Tree Servicing. My attorney submitted the application to Green Tree several times and in XXXX, they denied my application. My attorney advised me that Judge XXXX had setup a portal to monitor the banks handling of the process and I was forced back into bankruptcy. We had to make trial payments before being accepted into the process and on XX/XX/XXXX I signed the modification. 

At this same time The FTC entered into a settlement agreement with Green Tree which was signed on or about XX/XX/XXXX. In this agreement Green Tree entered into settlement in part for Green Trees misrepresentatio"
8218850,Credit reporting or other personal consumer reports,Credit reporting,Improper use of your report,Reporting company used your report improperly,"TRANSUNION INTERMEDIATE HOLDINGS, INC.",TX,Web,Yes,N/A,2024-01-25,legal_risk,488,"In accordance with the Fair Credit Reporting Act, Attorney General XXXX XXXX XXXX  # XXXX, Attorney General XXXX XXXX XXXX  # XXXX, XXXX XXXX XXXX account # xxxxxxXXXX, XXXX XXXX account # XXXX, XXXX XXXX account # XXXX, has violated my rights. Under XXXX5 U.S.C. Code 6802b states a consumer reporting agency can not service the consumers account with a financial institution and to protect the confidentiality or security of the financial institution records pertaining to the consumer."
