complaint_id,product,sub_product,issue,sub_issue,company,state,channel,timely_response,consumer_disputed,date_received,next_best_action_candidate,narrative_length,narrative_preview
7974202,Credit reporting or other personal consumer reports,Credit reporting,Improper use of your report,Reporting company used your report improperly,"EQUIFAX, INC.",TN,Web,Yes,N/A,2023-12-10,escalate_for_fraud_review,317,On XX/XX/2020 I called all three Credit bureaus. I notify them that that was information my credit report regarding medical bills that were not mine. I spoke to the fraud department of all three girls and they advised me to call the creditor because they were not going to remove it without consent from the creditor.
3196226,"Credit reporting, credit repair services, or other personal consumer reports",Credit reporting,Incorrect information on your report,Account information incorrect,MIDFIRST BANK,SC,Web,Yes,N/A,2019-03-30,escalate_for_fraud_review,950,"I am disputing the negative credit reporting to my credit report. I have worked hard to not have any negative credit reporting from Midland Mortgage. A stop payment was put on my account by my bank XXXX XXXX that I did not authorize. I paid my mortgage before it was 30 days late. When the payment was returned because of the stop payment. The bank realized that the stop payment was not authorized and removed it. I sent the payment the next day and it was paid. I sent my mortgage company a copy of an email from the bank saying that the stop paid was not authorize and removed. I asked the mortgage company to remove the negative reporting from my credit report because this was not my fault. 

Also, I have negative reporting status while I was under a modification plan. I do not feel that I should still be reported 120 or later while I was completing a modification plan. I was out of work 13 weeks and was late on my account. I had XXXX XXXX."
3348688,"Credit reporting, credit repair services, or other personal consumer reports",Credit reporting,Problem with a credit reporting company's investigation into an existing problem,Was not notified of investigation status or results,"TRANSUNION INTERMEDIATE HOLDINGS, INC.",FL,Web,Yes,N/A,2019-08-21,review_credit_reporting_dispute,464,After doing several disputes with XXXX and TransUnion  I am still not getting the investigation that I asked for. By all three companies not doing the investigation it is allowing negative remarks on my credit report. Enclose is the information that I sent to all three companies and the Creditor asking for validation. The information was completely ignored from creditor XXXX. All three creditors failed to do an investigation before reporting false information.
3048184,Student loan,Private student loan,Dealing with your lender or servicer,Received bad information about your loan,"Navient Solutions, LLC.",TX,Web,Yes,N/A,2018-10-16,investigate_billing_or_transaction,2631,"Navient XXXX XXXX XXXX XXXX, PA XXXX This student loan company gave me false information about my student loan, although I was making payments, and was diligent about annual renewals, and communication. The problems have been ongoing and Navient has withheld the truth about the loan. I discovered the extent of the dishonesty when I decided to consolidate all of my loans. 
In XX/XX/XXXX I began the process of consolidating all of my loans at the Federal Government rate of 6 %. I tried to negotiate a lower rate than the +9 % I was paying but Navient refused. 
As I began the consolidation process that would add the Navient loan to my XXXX, I was told my loan could be added and yet as I continued to talk to XXXX, I was told over and over that the loan was not a federal loan but a private one. I called Navient, and was told the opposite. They swore it was a federal loan, and someone who was a supervisor even promised to access the national data base files and ensure that my loan would be recognized as such. He even told me to call back in 3 days to ensure that all of the work was done. When I called back I was transferred a number of times, and then hung up on by the agents. 

XX/XX/XXX"
3501351,"Credit reporting, credit repair services, or other personal consumer reports",Credit reporting,Problem with a credit reporting company's investigation into an existing problem,Their investigation did not fix an error on your report,"TRANSUNION INTERMEDIATE HOLDINGS, INC.",IL,Web,Yes,N/A,2020-01-18,escalate_for_fraud_review,133,XXXX is continually reporting derogatory items even after police report was sent over showing these items were due to Identity theft.
3538022,"Credit reporting, credit repair services, or other personal consumer reports",Credit reporting,Improper use of your report,Reporting company used your report improperly,Experian Information Solutions Inc.,AZ,Web,Yes,N/A,2020-02-20,review_credit_reporting_dispute,480,"XXXX XXXX XXXX signed me up without my permission and included me in Experian Credit Protection without my permission. I in turned went to the Experian account online and requested the removal of the credit inquiry from XXXX and to remove my name from their protection account file. They then released my name and phone number to thousands of insurance companies, financial help sites, bankruptcy attorneys and so on. I am getting 500 calls a day and can not get it stopped. HELP."
3508680,Debt collection,I do not know,Attempts to collect debt not owed,Debt is not yours,Phoenix Financial Services LLC,VA,Web,Yes,N/A,2020-01-25,review_credit_reporting_dispute,66,Collections account reported on my credit report that is not mine.
3668458,"Credit reporting, credit repair services, or other personal consumer reports",Credit reporting,Incorrect information on your report,Information belongs to someone else,"TRANSUNION INTERMEDIATE HOLDINGS, INC.",GA,Web,Yes,N/A,2020-05-26,review_credit_reporting_dispute,233,I RECENTLY OBTAINED A COPY OF MY CREDIT REPORT. THERE WERE ACCOUNTS AND INQUIRIES THAT DO NOT BELONG TO ME. THESE FRAUDULENT ACCOUNTS ARE CAUSING ME UNNECESSARY HARDSHIP. PLEASE INVESTIGATE THESE ACCOUNTS AND SEND ME AN UPDATED COPY.
3647114,"Credit reporting, credit repair services, or other personal consumer reports",Credit reporting,Problem with a credit reporting company's investigation into an existing problem,Was not notified of investigation status or results,"EQUIFAX, INC.",TX,Web,Yes,N/A,2020-05-11,escalate_for_fraud_review,3188,"Dear Legal Department, This credit dispute is being submitted as a new evidence dispute. The accounts that are being disputed, does not belong to me. Below is my sworn statement concerning these credit issues. 

It is my sworn statement that I declare under penalty of perjury ( "" under the laws of the United States "" if executed outside of the United States '' ) that the foregoing is true and correct to the best of my knowledge. Further, I certify that I am qualified and authorized to file this dispute. I also understand that knowing and a willful misstatement or omissions of material facts constitutes a federal criminal violation punishable under 18 U.S.C. 1001. Additionally, these misstatements are punishable l1S perjury under 18U.S.C. 1621. 

The tradelines listed below are items currently within my credit file, and none of these are related to any transaction that was made by me. It is my official statement that someone and/or several people have opened these accounts and made transactions on these accounts without my knowledge or authorization, my personal information has been used to obtain goods, services, or money : and the person ( s ) responsible for creating these accoun"
3532247,Student loan,Private student loan,Dealing with your lender or servicer,Trouble with how payments are being handled,"Social Finance, Inc.",NY,Web,Yes,N/A,2020-02-14,manual_agent_review,1933,"On or about XX/XX/XXXX, I signed a promissory note with SoFi Lending agreeing to refinance XXXX for a 7-year loan term at a fixed interest rate of 3.506 % consisting of 84 payments beginning XX/XX/XXXX and ending XX/XX/XXXX. According to the promissory note each payment would be in the amount of {$2000.00}. With auto pay that rate was reduced to 3.256 %, which I understand would serve to accelerate the number of payments, and not decrease the monthly payment amount. Since the loan funded I have had the following payments automatically withdrawn from my checking account : XX/XX/XXXX - {$2000.00} ; XX/XX/XXXX - {$2000.00} ; XX/XX/XXXX - {$2000.00} ; XX/XX/XXXX - XXXX. Notably 3 of these amounts are different, and all are above the {$2000.00} amount included in the promissory note. 

On XX/XX/XXXX, I received correspondence from XXXX, the SoFi loan servicer, that my repayment schedule had changed. It reflected an interest rate of 4.006 % and a monthly payment of {$2000.00}. I contacted XXXX and although they could not confirm why I received that letter, they assured me my rate was 3.256 % I requested a copy of my promissory note, which was provided to me by XXXX. 

On XX/XX/XXXX, as I"
3443894,"Credit reporting, credit repair services, or other personal consumer reports",Credit reporting,Problem with a credit reporting company's investigation into an existing problem,Their investigation did not fix an error on your report,"TRANSUNION INTERMEDIATE HOLDINGS, INC.",MN,Web,Yes,N/A,2019-11-19,investigate_billing_or_transaction,1432,"I purchased two phones from XXXX who is a wholesale retailer for XXXX XXXX. Both phones were returned on XXXX XX/XX/2018 to XXXX and XXXX provided a refund receipt. A refund receipt and credit card refund is attached. The return was within the remorse period by XXXX and honored by XXXX. 

XXXX was not able to communicate the refund to XXXX XXXX  and they called be about the amount due after many months. I told XXXX that the devices were returned and they need to call their retailer. XXXX made no attempt to reach out to XXXX and so I personally went to the store and asked him to resend the cancellation. XXXX provided a copy of refund receipt. 
XXXX then sent the amount to the collection and every time I tell collection agency that it has been returned, they sell it to other collection agencies. 
I reached out to Transunion to correct the reporting but they reach out to XXXX who keeps confirming. Both TUC and XXXX are ignoring refund receipt. 

I have to pay a higher interest rate due to collection and more recently denied credit due to the collection on my report. I have called XXXX but they keep saying that the account is in the collection and they can not open my file. so I am in "
3453337,Checking or savings account,Checking account,Managing an account,Deposits and withdrawals,CAPITAL ONE FINANCIAL CORPORATION,NV,Web,Yes,N/A,2019-11-28,manual_agent_review,744,On XX/XX/XXXX i made a mobile deposit. On XX/XX/XXXX the check cleared and was in my account under my current and my availabie balance. XXXX was the amount. I have not had acess to my funds at all its been 7 months. They say a check could take up to 3 years to be returned. Now XXXX XXXX  has paid the check it has cleared. Now there telling me that i need to find the person who wrote the check have them call capital one 360 on from a number they can verfiy. I was paid for one time cleaning job to salvage and clean belongings left from a house fire. This person moved to FL why cant they go threw his bank to find him and if there was a issue i dont think his bank would of paid it. I bank with capital one 360 checking my name is XXXX XXXX
3464065,"Credit reporting, credit repair services, or other personal consumer reports",Credit reporting,Incorrect information on your report,Account status incorrect,"Waypoint Resource Group, LLC",UT,Web,Yes,N/A,2019-12-10,manual_agent_review,296,Waypoint Resource Group #XXXX is in violation of my 30 day right to dispute. I never received a notice for this collection and only became aware of it when I had my credit pulled and saw it on the report. This should not be on my credit as a collection and I never received anything for this debt
8207341,Mortgage,Conventional home mortgage,Trouble during payment process,"Escrow, taxes, or insurance","Shellpoint Partners, LLC",FL,Web,Yes,N/A,2024-01-23,review_credit_reporting_dispute,671,"I wanted my escrow payments removed from my account. I was denied twice and finally received an answer that it is because I had a deferred payment put on the back end years ago. I explained to the company that # 1, I was never told that this would hinder me controlling my own escrow, nor did I sign anything stating this, and # 2 I would be happy to pay that deferred payment back, right now. I have never missed a payment and have a outstanding credit report. I've tried to speak with a higher up manager, only to be denied. It is not right that the mortgage company is holding more money that is owed every year. I would like to be responsible for paying my own taxes."
3187785,"Payday loan, title loan, or personal loan",Installment loan,Getting the loan,,"Capital Alliance Financial, LLC",NY,Web,Yes,N/A,2019-03-22,manual_agent_review,532,"This place is a scam. They offered me a XXXX loan and said I had to buy XXXX XXXX   because of problems with my credit. They took the logo and name, XXXX XXXX XXXX, from a machine finance company in XXXX which when confronted with they denied. He then asked me to go get a XXXX XXXX card to pay the XXXX XXXX which sent up red flags. The guy I was talking to was named XXXX XXXX and his number is XXXX. I'm sure it's not his real name as he had a thick XXXX accent. They are preying on people like me who are in financial straights."
3374177,"Credit reporting, credit repair services, or other personal consumer reports",Credit reporting,Incorrect information on your report,Account information incorrect,"TRANSUNION INTERMEDIATE HOLDINGS, INC.",CA,Web,Yes,N/A,2019-09-14,manual_agent_review,881,"I contacted XXXX and get better understanding off my loan. The loan was originally with XXXX XXXX but they closed down and XXXX bought the loan. 
I don't understand what's going on with this loan ( ACCT : XXXX ). For the month of XX/XX/XXXX {$250.00} were paid to XXXX XXXX/XXXX but the customer service representative told me over the phone that only {$100.00} was received. The total payoff for the loan should be less than {$450.00} at the moment but I'm being told that there's a higher amount and I don't have to pay until XX/XX/XXXX. How is this possible? Could you please help understand what is going on. Attached to this email is a copy of Leave and Earning Statement ( LES ) and Allotment information that shows my payments. I believe the interest rate of this loan has raised without my knowledge and agreement. The company is NOT reporting to the Credit Bureaus at all."
3238179,Debt collection,I do not know,Attempts to collect debt not owed,Debt is not yours,"Security Credit Services, LLC",NC,Web,Yes,N/A,2019-05-10,review_credit_reporting_dispute,592,"Security Credit Svcs recently reported a {$1400.00} collection account on my credit report. They are stating that the original creditor is a company called XXXX XXXX. I have never heard of this company, much less had an account with them. Needless to say, I have made Security Credit Svcs aware of this, but they refuse to take it off of my report. When I last spoke with their reps, they said I should dispute the account with XXXX, XXXX, and XXXX XXXX. They said that if the account was not mine, it would be deleted. Well, I did that ; and the account is still reporting on my credit file."
3390164,Credit card or prepaid card,General-purpose credit card or charge card,Getting a credit card,Card opened as result of identity theft or fraud,AMERICAN EXPRESS COMPANY,MD,Web,Yes,N/A,2019-09-30,escalate_for_fraud_review,3747,"These are fraudulent collection opened by someone who stole my identity. 
Pursuant to the Fair Debt Collection Practices Act, Section 809 ( b ), Validating Debts : If the consumer notifies the debt collector in writing within the thirty-day period described in subsection ( a ) that the debt, or any portion thereof, is disputed, or that the consumer requests the name and address of the original creditor, the debt collector shall cease collection of the debt, or any disputed portion thereof, until the debt collector obtains verification of the debt or any copy of a judgment, or the name and address of the original creditor, and a copy of such verification or judgment, or name and address of the original creditor, is mailed to the consumer by the debt collector. ( Emphasis added ) Therefore I am disputing this debt because I do not owe it.

Because I am disputing this debt, you should not report it to the credit reporting agencies. If you have already reported it, please contact the credit reporting agencies, inform them that the debt is disputed, and ask them to delete it from my credit report. Reporting information that you know to be inaccurate, or failing to report information cor"
3592923,"Credit reporting, credit repair services, or other personal consumer reports",Credit reporting,Problem with a credit reporting company's investigation into an existing problem,Was not notified of investigation status or results,"TRANSUNION INTERMEDIATE HOLDINGS, INC.",CA,Web,Yes,N/A,2020-04-04,review_credit_reporting_dispute,204,I submitted a dispute to TRANSUNION regarding accounts that is not mine and it has been more than 60 days and no response from them. TransUnion disregarded the law by not responding to consumers disputes.
3078727,"Credit reporting, credit repair services, or other personal consumer reports",Credit reporting,Incorrect information on your report,Information belongs to someone else,Experian Information Solutions Inc.,FL,Web,Yes,N/A,2018-11-20,escalate_for_fraud_review,4964,"This information was gathered personally from me from the identitytheft.gov website. I am acting on behalf of myself and not a credit repair company.

Experian continues to disregard the Federal Laws for Identity Theft. a ) Block. Except as otherwise provided in this section, a consumer reporting agency shall block the reporting of any information in the file of a consumer that the consumer identifies as information that resulted from an alleged identity theft, not later than 4 business days after the date of receipt by such agency of ( 1 ) appropriate proof of the identity of the consumer ; ( 2 ) a copy of an identity theft report ; ( 3 ) the identification of such information by the consumer ; and ( 4 ) a statement by the consumer that the information is not information relating to any transaction by the consumer. ( b ) Notification. A consumer reporting agency shall promptly notify the furnisher of information identified by the consumer under subsection ( a ) of this section ( 1 ) that the information may be a result of identity theft ; ( 2 ) that an identity theft report has been filed ; ( 3 ) that a block has been requested under this section ; and ( 4 ) of the effective dates"
4329943,"Money transfer, virtual currency, or money service",Domestic (US) money transfer,Fraud or scam,,"BANK OF AMERICA, NATIONAL ASSOCIATION",PA,Web,Yes,N/A,2021-04-27,escalate_for_fraud_review,5412,"On XX/XX/2021, my husband received an email from XXXX indicating that his account had been compromised and asked that he call a given telephone number for assistance. My husband called the telephone listed on the email and spoke to an agent who gave him several confusing explanations as to what and how his account had been compromised, none of which made sense to him. My husband became suspicious and told them that he was going to contact our bank, Bank of America, but the agent insisted that he not call the bank because they would not help us with his XXXX account. Further, the agent insisted that he transfer money to them to resolve the issue. Not knowing whether to believe this person or not, my husband asked me to help him, thus I took over communications with this agent. I was also given confusing explanations and warnings not to contact our bank and through demands and intimidation was convinced to create an email account thru XXXX to make money transfers to them, to a provided email address. In my confusion and efforts to rectify my husband 's XXXX account, I made three money transfers to the email provided for a total of {$3400.00}. 
I would like to emphasize that both my h"
3583536,"Credit reporting, credit repair services, or other personal consumer reports",Credit reporting,Problem with a credit reporting company's investigation into an existing problem,Was not notified of investigation status or results,"TRANSUNION INTERMEDIATE HOLDINGS, INC.",FL,Web,Yes,N/A,2020-03-27,review_credit_reporting_dispute,924,"I have been disputing derogatory public record that is on my credit. On XX/XX/XXXX I opened a dispute report # XXXX with XXXX, XXXX and Transunion. Also XX/XX/XXXX report # XXXX as well as XX/XX/XXXX report # XXXX. I never received an update for report # XXXX.When i got the results for report # XXXX it stated "" The company that reported the information has certified to XXXX  that the information is accurate.This item was not changed as a result of our processing of your dispute. The company that reported this derogatory public record is XXXX XXXX.I then requested proof of verification from XXXX, XXXX  and Transunion and was told that they don't have to disclose there proof of verification with me. After so many countless attempts the last one being on XX/XX/XXXX i have not received an information or status dealing with this last attempt to resolve this derogatory public record. Please assist me with this issue."
3746585,"Money transfer, virtual currency, or money service",Virtual currency,Other transaction problem,,"Block, Inc.",TX,Web,Yes,N/A,2020-07-15,manual_agent_review,730,"Someone sent me {$25.00} on XX/XX/XXXX through cashapp. I saw the notification on my phone but did not cash out immediately. When I went back a few days later, the money was not there. When I clicked on the transaction, it said it was waiting on the person to complete the payment. The person who sent it stated that they had taken the money out of her account and that on her end, it said they were waiting for me to accept it. She has spoken with them several times and they keep confirming the amount was sent and that I just need to cash out. However, there is nothing there to cash out. I have contacted them myself and have not gotten a response. Ironically, the transaction has now disappeared from my list of transactions."
3725287,Mortgage,VA mortgage,Applying for a mortgage or refinancing an existing mortgage,,NAVY FEDERAL CREDIT UNION,NY,Web,Yes,N/A,2020-07-01,review_mortgage_servicing_case,2271,"My wife and I applied for a VA 15 year mortgage through Navy Federal Credit Union in XX/XX/XXXX. More than six weeks later, it was denied for inadequate income. Navy Federal would not consider the more than {$400000.00} in annual income we would receive from the XX/XX/XXXX sale of XXXX XXXX that we owned for more than 30 years. Subsequently, Navy Federal moved us to a conventional, 30 year mortgage at a higher interest rate. 

The failure of Navy Federal to act timely, to look at the source of our income and how long we had that income was unconscionable in our eyes. From day one, it was clear that we had sold our business and our principal source of income was now through a 20 year contract with the employees who bought the business. By the time Navy Federal acted, we were so deep into the process, we were compelled to continue on the path they directed or we would have lost the home. The sellers had grown impatient with the delays. 

Particularly egregious to us was that in reviewing VA lending guidelines, as set out in VA pamphlet 26-7, we should have readily qualified for exceptions to requiring we have our new source of income for 24, as well as 12 months. Prior to starting ou"
8162321,Credit reporting or other personal consumer reports,Credit reporting,Incorrect information on your report,Information belongs to someone else,"TRANSUNION INTERMEDIATE HOLDINGS, INC.",TX,Web,Yes,N/A,2024-01-12,review_credit_reporting_dispute,833,"I am the author of this complaint and I have attached a copy of my driver 's license and social security card to verify my identity. I tried to apply for credit and was swiftly denied, which led me to check my credit report. I noticed several creditors and collection agencies that are reporting incomplete, incorrect, and downright fraudulent information. I have attached letters below in the attachments which will show the accounts that I am calling into question. 

The credit bureaus are allowing reporting in such a way that violates the Fair Credit Reporting Act and the Fair Debt Collection Practices Act. 15 USC 1681s-2b and 15 USC 1681b are being blatantly violated and from my research all parties can be held civilly liable. 

The credit bureaus are not conducting a reasonable investigation like they are obligated to do"
8248342,Credit reporting or other personal consumer reports,Credit reporting,Improper use of your report,Reporting company used your report improperly,"American Credit Acceptance, LLC",MD,Web,Yes,N/A,2024-01-30,review_credit_reporting_dispute,279,I don't recall applying for credit with this company. I need to see written or authorization proof that I allowed this inquiry. I have also contacted them back in XXXX  with still no answer leaving me with ( XXXX ) hard inquiries on my credit report violating my FCRA Act rights.
3463467,"Credit reporting, credit repair services, or other personal consumer reports",Other personal consumer report,Incorrect information on your report,Public record information inaccurate,One Source Technology,TN,Web,Yes,N/A,2019-12-10,manual_agent_review,142,In XX/XX/2019 it was brought to my attention that Asurint was reporting inaccurate information and I am requesting that this issue be resolved
