complaint_id,product,sub_product,issue,sub_issue,company,state,channel,timely_response,consumer_disputed,date_received,compliance_signal,narrative_length,narrative_preview
7665353,Credit reporting or other personal consumer reports,Credit reporting,Improper use of your report,Reporting company used your report improperly,"EQUIFAX, INC.",LA,Web,Yes,N/A,2023-10-10,legal_risk,2136,"There's great concern regarding inaccurate information that has persistently appeared on my credit profile. I have diligently disputed these inaccuracies in accordance with the Fair Credit Reporting Act ( FCRA ) and the Fair Debt Collection Practices Act ( FDCPA ) on more than three occasions. Despite my efforts and the clear violations of these laws, the concerns have been consistently ignored. This prolonged period of inaccurate information on my credit report has had a detrimental financial impact in my life.

It's worth noting that 15 U.S. Code 1681, which outlines Congressional findings and the statement of purpose, emphasizes the importance of accuracy and fairness in credit reporting. The intent of the law is to ensure that credit reporting agencies maintain the accuracy of consumer information. Furthermore, 15 U.S. Code 1681b mandates that credit reporting agencies must employ reasonable procedures to ensure the accuracy of the information they collect and report.

Pay attention that 15 US CODE 1681i stipulates that credit reporting agencies are obligated to delete inaccurate information from consumers ' credit reports. Furthermore, 15 US CODE 1681 emphasizes the importance"
5473165,"Credit reporting, credit repair services, or other personal consumer reports",Credit reporting,Improper use of your report,Credit inquiries on your report that you don't recognize,SYNCHRONY FINANCIAL,TX,Web,Yes,N/A,2022-04-20,legal_risk,366,I have contacted XXXX regarding fraudulent inquiries on my report. I sent a certified letter requesting removal of these items. XXXX has confirmed receipt but told me I need to file a police report and refused to assist with the removal of the inquiries. My letter to them was sent to them 6 or more months ago and I would like this addressed immediately. Thank you.
20406880,Checking or savings account,Checking account,Closing an account,Company closed your account,"CITIBANK, N.A.",IL,Web,Yes,N/A,2026-03-19,legal_risk,217,"Citibank is closing my account with explanation, they are also trying to hold my money in the account for 60 days, which I spoke with a lawyer and they stated thats illegal, Im asking they release my fund immediately."
8355718,Credit reporting or other personal consumer reports,Credit reporting,Incorrect information on your report,Information belongs to someone else,"TRANSUNION INTERMEDIATE HOLDINGS, INC.",TX,Web,Yes,N/A,2024-02-15,legal_risk,3166,"I am writing to express my deep dissatisfaction and concern regarding the ongoing issue of fraudulent items persisting despite repeated attempts to remove them. As a customer of Credit Bureaus. I expect transparency, reliability, and prompt action in addressing such matters. 

However, despite my efforts and numerous notifications, these items continue to exist unabated. This not only undermines my trust in your organization 's integrity but also poses a significant risk to my personal information and financial security. 

The persistence of these fraudulent items reflects poorly on Credit Bureaus commitment to combating fraudulent activities and protecting its customers. It is unacceptable that such discrepancies persist despite being brought to your attention multiple times. 

I urge you to take immediate and decisive action to rectify this situation. Specifically, I request the following actions : Conduct a thorough investigation into the root cause of the issue, including any potential vulnerabilities in your systems or processes that may be enabling fraudulent activities to persist. 

Implement robust measures to prevent further occurrences of fraudulent items and ensure the s"
11923716,Credit reporting or other personal consumer reports,Credit reporting,Incorrect information on your report,Information belongs to someone else,Experian Information Solutions Inc.,KY,Web,Yes,N/A,2025-02-04,legal_risk,1203,"I am writing to contest inaccurate information on my credit report in accordance with 15 U.S.C. 1681c-2 and to formally request the blocking of this erroneous data.Enclosed is a copy of my Police Report/FTC identity theft report ( FTC REPORT XXXX as evidence supporting my identity theft claim. As per 15 U.S.C. 1681e-2, upon submission of an identity theft report by a consumer, credit reporting agencies obligated to block any information flagged by the consumer as stemming from identity theft within FOUR business days. The following information on my credit report is the result of identity theft and should be blocked : I am writing to notify you that I have fallen prey to identity theft. I have reached out to the Federal Trade Commission and lodged a complaint, which is enclosed for vour reference. Mv credit report contains fraudulent ACCOUNTS and INQUIRIES that are not associated with me. All necessary documentation is included in this packet, and copies have been sent to your agency both via fax and through Certfied mail. In addition, I request the immediate removal of the following fraudulent ACCOUNTS and INOUIRIES from my credit report. ACCOUNTS : XXXX XXXX XXXX XXXX XXXX XXXX X"
14638362,Credit reporting or other personal consumer reports,Credit reporting,Improper use of your report,Credit inquiries on your report that you don't recognize,"TRANSUNION INTERMEDIATE HOLDINGS, INC.",TX,Web,Yes,N/A,2025-07-15,legal_risk,933,"This CFPB complaint has been filed to request pursuant to FCRA 605B ( 15 U.S.C. 1681c-2 ) that you, the TRANSUNION credit reporting agency , block information appearing on my consumer credit report that is the result of identity theft and fraud within 4 business days of you receiving this complaint. This fraudulent, inaccurate, and false information consists of XXXX XXXX XXXXXX/XX/XXXX XXXX XXXX XXXX XXXX XXXXXXXX XXXX - XX/XX/XXXX These accounts have resulted in several fraudulent hard inquiries and fraudulent collections appearing on my consumer FICO credit report. All of the aforementioned accounts, collections, and hard inquiries are the result of identity theft and fraud. I have attached a copy of FTC Identity Theft Criminal Complaint XXXX as proof from the US Federal Trade Commission that all of the aforementioned consumer credit accounts, collections, and hard inquiries are the result of identity theft and fraud."
8915049,Credit reporting or other personal consumer reports,Credit reporting,Incorrect information on your report,Information belongs to someone else,"EQUIFAX, INC.",GA,Web,Yes,N/A,2024-05-02,legal_risk,225,I have submitted multiple disputes regarding these accounts that do not belong to me and they are still reporting on my credit report. I have also submitted multiple FTC Reports regarding the account that do not belong to me.
13244279,Credit reporting or other personal consumer reports,Credit reporting,Improper use of your report,Reporting company used your report improperly,"TRANSUNION INTERMEDIATE HOLDINGS, INC.",TX,Web,Yes,N/A,2025-04-29,legal_risk,504,"My credit reports contain inaccuracies that are negatively impacting my ability to obtain credit. Under the Fair Credit Reporting Act ( FCRA ), credit reporting agencies are required to report only accurate and verifiable information. As it is your legal obligation to ensure the accuracy of consumer information, I request an investigation into these accounts and inquiries. Please update or remove any unverifiable or inaccurate items to comply with FCRA regulations and prevent potential legal action."
14426876,Credit reporting or other personal consumer reports,Credit reporting,Incorrect information on your report,Information belongs to someone else,Experian Information Solutions Inc.,TX,Web,Yes,N/A,2025-07-02,legal_risk,3969,"I am filing a formal complaint against Experian for its repeated and willful violations of the Fair Credit Reporting Act ( FCRA ). For over a year, I have submitted multiple disputes and identity theft documentation to Experian regarding fraudulent accounts that were opened without my knowledge or consent. 

Despite my good faith efforts, Experian continues to allege that these accounts are valid, even though they are the result of identity theft. I have never opened or authorized these accounts, and there is no valid documentation, contract, or proof that ties these accounts to me. 



Fraudulent Accounts That Must Be Blocked and Deleted : The following accounts are not mine, and are the direct result of identity theft. They must be immediately blocked and permanently removed in accordance with FCRA XXXX : Account Name : XXXX XXXX XXXX Account Number : XXXX Account Name : XXXX XXXX XXXX XXXX Account Number : XXXX Experians Legal Violations : 1. FCRA 605B ( 15 U.S.C. 1681c-2 ) Blocking of Information Resulting from Identity Theft Experian is required to block identity theft-related information within 4 business days of receiving a valid police report or FTC Identity Theft Report. I"
4569610,Debt collection,Credit card debt,Took or threatened to take negative or legal action,Threatened to sue you for very old debt,ENCORE CAPITAL GROUP INC.,FL,Web,Yes,N/A,2021-07-23,legal_risk,2302,"On XX/XX/2021 I received a summons to appear in court for an alleged credit card debt from Midland Credit Management. I was later visited by the city police XX/XX/2021 regarding the original summons I received on XX/XX/2021 from Attorney XXXX XXXX, XXXX. From my understanding of consumer law, according to 15 USC 1692 ( e ) this section is titled false or misleading representation, Midland Credit Management is in violation of my consumer rights and I want to compensated for the damages which I am entitled to according to 15 USC 1692 ( k ). A law firm can not attempt to collect a debt on be half of the creditor. That's illegal because the states that law firms can not act as debt collectors. I sent a certified noticed to Midland Credit Management on XX/XX/2021 demanding them to cease and desist as well as an invoice for the violation. There are other violations that Midland Credit Management has conducted such as 15 USC 1692 ( i ) in which congress makes it clear that bringing legal action by debt collector is unauthorized and 15 USC 1692a ( 6 ) ( A ) ( C ) ( D ) ( 6 ). The term debt collector means any person who uses any instrumentality of interstate commerce or the mails in any bu"
9333110,Credit reporting or other personal consumer reports,Credit reporting,Incorrect information on your report,Information belongs to someone else,"EQUIFAX, INC.",MD,Web,Yes,N/A,2024-06-25,legal_risk,426,"I have submitted multiple disputes regarding these accounts that do not belong to me and they are still reporting on my credit report. I have also submitted and multiple FTC Reports regarding the account that do not belong to me. 

Account name : XXXX XXXX XXXX XXXX Account Number : XXXX Account name : XXXX Account Number : XXXX Account name : XXXX  XXXX XXXX Account Number : XXXX Account name : XXXX  Account Number : XXXX"
12660464,Credit reporting or other personal consumer reports,Credit reporting,Problem with a company's investigation into an existing problem,Their investigation did not fix an error on your report,"EQUIFAX, INC.",VA,Web,Yes,N/A,2025-03-23,legal_risk,1597,"SENT MY DISPUTE IN FOR INACCURATE REPORTING ON MY CREDIT REPORT. I WANTED THESE ACCOUTS DELETED UNDER THE FCRA BECAUSE OF THIS. THIS DID NOT HAPPEN. ALL I GOT BACK WAS UPDATE AND VERIFIED. HOW WAS THIS AND THESE ACCOIUNTS HAD INACCURICIES IN THE PAYMENT HISTORY AND THE DATE OF LAST ACTIVITY BETWEEN EQUIFAX, TRANSUION AND EXPERIAN. ( YOUR COMPANY DID NOT DO YOUR JOB AND YOU HAVE A LAWSUIT AGAIST YOU FOR THIS. ) I WILL BE TAKING ACTION IF THESE ACCOUNTS ARE NOT DELETED IMMEDIATELY. THESE WERE THE ACCONTS THAT WERE SUPPOSED TO BE DELETED FOR VIOLATING THE FCRA. : ( XXXX  ) ( XXXX  ) ( XXXX XXXX ) ( XXXX XXXX ) ( XXXX XXXX ) ( XXXX  ) ( XXXX XXXX  ) ( XXXX XXXX ) XXXX XXXX XXXX XXXX XXXX XXXX XXXX XXXX XXXX XXXX XXXX XXXX XXXX XXXX XXXX XXXX XXXX XXXX XXXX XXXX XXXX XXXX XXXX XXXX XXXX XXXX XXXX XXXX XXXX XXXX XXXX XXXX XXXX XXXX XXXX XXXX XXXX XXXX XXXX XXXX XXXX XXXX XXXX XXXX XXXX XXXX XXXX XXXX XXXX XXXX XXXX XXXX XXXX XXXX XXXX XXXX XXXX XXXX XXXX XXXX XXXX XXXX XXXX XXXX XXXX XXXX XXXX XXXX XXXX XXXX XXXX XXXX XXXX XXXX XXXX XXXX XXXX XXXX XXXX XXXX XXXX XXXX XXXX XXXX XXXX  THESE ACCOUNTS HAVE INACURATE INFORMATION IN THE PAYMENT HISTORY AND THE DATE OF LAST ACTIVITY BETWEEN EQU"
11778930,Debt collection,I do not know,Attempts to collect debt not owed,Debt is not yours,"EQUIFAX, INC.",FL,Web,Yes,N/A,2025-01-26,legal_risk,4545,"This notice is to inform you that you have unlawfully reported an alleged debt to my consumer report : Under the New Rule REGULATION F which took effect XX/XX/XXXX, You EQUIFAX You have violated the FDCPA 1006.30a and its new rule by parking this alleged debt on my consumer reports. Cease and Desist the reporting of this alleged Debt immediately or I will escalate this matter to taking legai action. I have not given you written permission to put anything on my credit protile 15 USC 1681b2. You have no permissible purpose by law to contact third parties with my private or personal information. Your oftenses amount to Aggravated Identity Theft pursuant to 18 U.S.C. 1028A. You have knowingly transferred, possessed, or used, without s lawful authority, a means of identification of me, which is a felony punishable with up to 2 years of imprisonment, in addition to civil liability. I AM A LITIGIOUS CONSUMER I WILL NOT HESITATE TO TAKE LEGAL ACTION AGAINST | EQUIFAX 15 USC 1692c ( c ) Ceasing communication If a consumer notifies a debt collector in writing that the consumer refuses to pay a debt or that the consumer wishes the debt collector to cease further communication with the consume"
5243858,"Credit reporting, credit repair services, or other personal consumer reports",Credit reporting,Improper use of your report,Reporting company used your report improperly,Experian Information Solutions Inc.,VA,Web,Yes,N/A,2022-02-21,legal_risk,276,"I am very concerned about the items that are being shown on my credit report. Not only are they inaccurate, they are also unjust, because they should not be reporting on my credit report! I ask that you delete these accounts, or I will be filing a legal complaint against you!"
12307101,Checking or savings account,Checking account,Opening an account,Unable to open an account,PNC Bank N.A.,OH,Web,Yes,N/A,2025-03-05,legal_risk,570,"I went to open a bank account with pnc, but I was denied. When I requested the reason why I was denied by the teller and told it was because I had an outstanding balance with pnc. pnc never notified me that they were going to report this information to any consumer reporting agency and the information they reported is not completely accurate per the FCRA. I am a single mother who needs my bank account to receive funds to take care of my family. The denial is hindering me from caring for my family. Failure to remove this info will result in me seeking legal remedy."
3967243,"Credit reporting, credit repair services, or other personal consumer reports",Credit reporting,Problem with a credit reporting company's investigation into an existing problem,Problem with personal statement of dispute,SYNCHRONY FINANCIAL,SC,Web,Yes,N/A,2020-11-20,legal_risk,2647,"Dated Fri, XX/XX/2020 addressed upon complaining with Synchrony and Lowes stamp if relaying XXXX XXXX XXXX florida XXXX Attn : Fair Credit Reporting I am being unfairly denied credit and see an in accurate piece of information. 

My name is XXXX XXXX XXXX and I am asking for a reason the credit has been denied during a application I personally made in the last 72 hours with Synchrony Bank and Lowe 's Credit. 

I have a score that's is XXXX or above yet Lowes reports the score at the number ( s ) XXXX. 

My score is XXXX with XXXX XXXX XXXX respective using the XXXX XXXX app which is very well established and reputable. In fact, my credit is updated everyday and everything looks outdated and inaccurate with the Lowes denial Synchrony ongoing hard even too recognize if understand problem. 

Why is an old in accurate record preventing myself from getting fair and accurate credit reported. A copy of this letter will be sent wearily if further access is not being provided to the board of credit to foil the old dusty gathering of information. 

I can tell you I have zero disputes, no frozen transactions, I've made over 60 months of payment ( s ), I am current and in more than satisfactor"
6905638,Debt collection,I do not know,Attempts to collect debt not owed,Debt was result of identity theft,V and H Portfolio,TX,Web,Yes,N/A,2023-04-28,legal_risk,665,VANCE AND HUFFMAN LLC ( XXXX XXXX ) is a result of identity theft. I recently discovered through my new monitoring service this account being reported I made efforts to remove this account from my file as the amount of {$1100.00} does not belong to me. This account was fraudulently opened through this company in XXXX of 2021 an has been reported to the FTC and authorities as Identity theft. I have submitted all of my information needed to resolve this matter in this complaint and through the FTC report attached and do not feel comfortable giving any further information in any way to any others at this time due to the further possibilities of identity theft.
12314917,Credit reporting or other personal consumer reports,Credit reporting,Incorrect information on your report,Information belongs to someone else,"EQUIFAX, INC.",FL,Web,Yes,N/A,2025-03-04,legal_risk,2118,"XX/XX/XXXX Manual verification is required from notice. These items are illegal and needs to be removed asap. 

Copies of my signature needs to be provided and dates. These accounts are illegal and as i stated needs to be removed. 

Under USC Sec 15 Under USC 1666b USC 1637 ( b ) 15 USC 1681s-2 15 USC 16811i 12 CFR 1006.34c 12 cfr 1006.6c 15 usc 1671e ( b ) 15 usc 1681s-2 ( A ) UCC 9 Part 6, and FCRA these accounts were already disputed and passed timeframe of removal from all three Credit Bureaus XXXX, Equifax, XXXX XXXX These accounts needs to be removed immediately. 

None of my signatures are on any of these fraudulent accounts. Also my name is XXXX XXXX XXXX stated on my credit report. All of these items are fraudulent and needs to be immediately removed! 


MY information was EXPOSED in multiple data breaches across XXXX, Equifax, and XXXX. I am writing to have these ILLEGAL items removed OFF my report ASAP! 

I received a copy of my credit reports and am writing to dispute the following FRAUDLENT/ILLEGAL/UNAUTHORIZED information that appears on my Equifax, XXXX, and XXXX report. 

Please verify or remove immediately the following accounts : By the provisions of the Fair Cred"
14608558,Credit reporting or other personal consumer reports,Credit reporting,Problem with a company's investigation into an existing problem,Their investigation did not fix an error on your report,"TRANSUNION INTERMEDIATE HOLDINGS, INC.",AL,Web,Yes,N/A,2025-07-11,legal_risk,912,"Experian has failed to fulfill its legal obligation under the Fair Credit Reporting Act ( FCRA ) to conduct a reasonable reinvestigation of disputed information on my credit report, leaving inaccurate or unverifiable accounts unresolved The Consumer Financial Protection Bureau ( CFPB ) has recently filed a lawsuit against Experian, alleging systemic issues such as failing to forward consumer-provided evidence to furnishers, accepting unreliable responses, and failing to adequately notify consumers of dispute outcomes. These failures align with my experience, where Experian has neither corrected nor removed disputed items despite the evidence I provided, causing ongoing harm to my credit standing. I am requesting immediate corrective action to remove or amend the disputed accounts, as Experian 's inaction violates federal law and my rights as a consumer. Account : XXXX XXXX XXXX XXXX XXXX {$20000.00}"
5789606,"Credit reporting, credit repair services, or other personal consumer reports",Credit reporting,Incorrect information on your report,Information belongs to someone else,Experian Information Solutions Inc.,NY,Web,Yes,N/A,2022-07-19,legal_risk,1127,"It occurs that my credit report has been compromised. Again, I was going through my files & noticed these accounts that do not belong to me. Since Im a stickler for research, I found that under section 605b of the FCRA you are required by law to remove any information or accounts which were found to be opened due to identity theft. The disputed accounts do not belong to my file. Im attaching the required FTC Report for you and the bank 's records ( learned through more research both parties require ). Please remove these accounts. XXXX XXXX XXXX XXXX Balance : {$490.00} ; XXXX XXXX Balance : {$0.00} If you feel there is a possibility these accounts belong to me I will require all documentation which bear my signature ( another research accounts I found that requires you to verify with 100 % accuracy that these accounts are 100 % true, accurate, correct, complete & VERIFIABLE ). If you do not provide any records & claim the accounts are verified please understand I will seek legal action. I do not take kindly to games nor does my attorney. SO please comply with the law so this matter can be handled immediately."
9265219,Credit reporting or other personal consumer reports,Credit reporting,Problem with a company's investigation into an existing problem,Their investigation did not fix an error on your report,"TRANSUNION INTERMEDIATE HOLDINGS, INC.",NJ,Web,Yes,N/A,2024-06-14,legal_risk,3483,"To Whom It May Concern, This Is my Third written request for Method of Verification. Your company has failed to provide me with this information and continue to violate my consumer and civil rights. I have been maintaining accurate logs of my letters and will file a complaint with the CFPB, XXXX Attorney General, and Secretary of state. These Unverified accounts continue to hinder my ability to obtain credit. Please provide me with the information below : I demand the following Unverified Accounts be Deleted Immediately. The unverified items listed below remain on my credit report in violation of Federal Law. You are required under the FCRA to have a copy of the original creditors documentation on file to verify that this information is mine and is correct. In the results of your first investigation, you stated in writing that you verified that these items are being reported correctly? Who verified these accounts? Describe the procedure used and method to determine the accuracy and completeness of the disputed information, including the business name, address and furnisher of information connected to any in accurate information. You need to do a reasonable investigation in complian"
4469387,Debt collection,Credit card debt,Written notification about debt,Didn't receive enough information to verify debt,"NRA Group, LLC",NY,Web,Yes,N/A,2021-06-17,legal_risk,3247,"XX/XX/XXXX XXXX XXXX XXXX XXXX XXXX XXXX XXXX, XXXX Social Security # XXXX DOB : XX/XX/XXXX I hereby make a ghost-letter attempt to a resolution on various credit items and/or items of public record that currently show on XXXX XXXX  XXXX XXXX and XXXX respectively. My position is legal based upon sections of the Fair Credit Reporting Act as well as the Fair Debt Collection Practices Act. These laws are to make sure that a level and fair playing field exist to protect American consumers from abusive reporting procedures on credit reports, as well as illegal and deceptive collection practices. I stipulate at this time that are no condition am U making an identity theft claim or accusation, so I demand that policy be adhered to by all creditors and respective credit reporting agencies. 
Amended consumer rights Fair Credit Reporting Act Public Law 15 U.S.C. 1681 : https : //www.consumer.ftc.gov/articles/pdf-0111-fair-credit-reporting-act.pdf Fair Debt Collection Practices Act : https : //www.ftc.gov/enforcement/rules/rulemaking-regulatory-reform-proceedings/fair-debt-collection-practices-act-text On these subscribers that are reporting the affixed information, I am requesting full vali"
8794702,Credit reporting or other personal consumer reports,Credit reporting,Improper use of your report,Reporting company used your report improperly,Experian Information Solutions Inc.,MS,Web,Yes,N/A,2024-04-18,legal_risk,1506,"I am writing to dispute the accuracy and legality of the information contained in my credit report maintained by your agency. Pursuant to the Fair Credit Reporting Act ( FCRA ) 15 USC 1681, I have not provided written consent for your agency to furnish my information to third parties or obtain my consumer information. 

Upon reviewing my credit report, I discovered that your agency has included information without my explicit consent. As per the FCRA, it is imperative that consumer reporting agencies obtain written consent from individuals before furnishing their information to third parties. I have not provided such consent, and therefore, the inclusion of this information in my credit report is in violation of my rights under the FCRA. 

I demand that your agency promptly investigate this matter and remove any information that was reported without my written consent. Additionally, I request that you provide me with documentation demonstrating that you obtained written consent from me to furnish my information to third parties, as required by law. 

Failure to comply with this request will result in further action, including but not limited to filing complaints with the Consumer F"
