complaint_id,product,sub_product,issue,sub_issue,company,state,channel,timely_response,consumer_disputed,date_received,next_best_action_candidate,narrative_length,narrative_preview
4015659,"Credit reporting, credit repair services, or other personal consumer reports",Credit reporting,Incorrect information on your report,Account information incorrect,"Caliber Home Loans, Inc.",NY,Web,Yes,N/A,2020-12-16,manual_agent_review,634,"I have sent an RFI to Caliber on XX/XX/2020 to which I got only a partial response. I did get a payment history which seemed confusing and I had sent a second letter to Caliber on XX/XX/2020 questioning some of the charges which seem to be questionable and don't add up. I will attach the letter I sent to Caliber along with the payment history which I am questioning. So far I got no response and the continued reporting of erroneous data is detrimental to me. 

Other issues of reporting are as follows : The full 7 year payment history is not listed High balance of {$250.00} is not accurate Date of first delinquency is not listed"
3584127,"Credit reporting, credit repair services, or other personal consumer reports",Credit reporting,Incorrect information on your report,Information belongs to someone else,Experian Information Solutions Inc.,FL,Web,Yes,N/A,2020-03-28,review_credit_reporting_dispute,357,"I have review my credit report to check accuracy and found out that a lot of account that I had no knowledge about are destroying my credit reputation and causing a lot of damage to my ability to obtain credit, these account are fraudulent and should not be in my credit, I what to request that these account be block from my credit immediately. 
Thank you."
8166905,Credit reporting or other personal consumer reports,Credit reporting,Incorrect information on your report,Information belongs to someone else,"I.C. System, Inc.",CA,Web,Yes,N/A,2024-01-17,manual_agent_review,183,I got a credit alert and upon checking my reports I saw an account that I do not owe and have no knowledge. The amount is {$89.00} on XX/XX/2024 form XXXX XXXX for XXXX. I am in XXXX.
3398394,Debt collection,Medical debt,Written notification about debt,Didn't receive notice of right to dispute,"EQUIFAX, INC.",MO,Web,Yes,N/A,2019-10-07,review_credit_reporting_dispute,359,"I received a notice on my credit report regarding this debt in 2017 and I called to correct to no availability. I disputed and advised on removal of even settled. They have not sent information to validate and I was able to dispute and get removed from XXXX  and XXXX, but Equifax has not removed. This debt was not proven valid and Im trying to remove again."
8249107,"Money transfer, virtual currency, or money service",Mobile or digital wallet,Fraud or scam,,"Paypal Holdings, Inc",CA,Web,Yes,N/A,2024-01-31,escalate_for_fraud_review,2095,"Hi there. 

In XXXX of last year, a former friend I helped start their business with committed credit card fraud and was able to make a chargeback through PayPal two months after paying me. Their claim violated Paypal 's terms, yet PayPal allowed the chargeback from the financial institution. I provided proof of completion of my services to this friend even though they claimed products weren't received and services, even though they are still using the imagery/brand direction I created. I provided all of this to PayPal. I spent months calling Paypal for updates and they gave me none until I called XX/XX/XXXX and they said the financial institution ruled against my favor. The financial institution took several months to make a decision, and decided in favor of my former friend, the fraudster. I asked PayPal as to why they made this decision and PayPal said they could not tell me, yet advised me to take this person to small claims court outside PayPal. I said I would need to know why their institution ruled against me and they said they could not tell me. I asked to talk to the financial institution or someone who works on these cases for PayPal and they said they could not do so. Th"
3476875,Debt collection,Mortgage debt,Attempts to collect debt not owed,Debt is not yours,Manley Deas & Kochalski LLC,IL,Web,Yes,N/A,2019-12-24,escalate_for_manager_or_compliance_review,446,Was wouking with XXXX XXXX and they decided to get attorneys involved. I received a letter from them on XX/XX/2019 and responded the vary same day with a Certified Letter. I never heard back from the company until last week when I called and spoke with an attorney named XXXX. XXXX claimed that they did receive my letter and replied on XX/XX/2019. I have never received any such communication from the company. I asked for a copy of your letter.
3495852,Checking or savings account,Savings account,Closing an account,Can't close your account,JPMORGAN CHASE & CO.,,Web,Yes,N/A,2020-01-14,manual_agent_review,1171,"In the XXXX I opened an account with a bank in XXXX AZ. Due to various mergers etc. this account is now with Chase- JPMorgan Chase . As I have not used the account for several years and I no longer have any family in the States it is rather pointless keeping it open. I have written in the last three months two letters to the bank asking them to close the account. No reaction either by email or by post to those letters. On XX/XX/XXXX I rang their customer service. I spoke to someone who confirmed the account balance and said that she could arrange account closure. The problem arose because I could not supply a US SSN, which was not needed when I opened the account. I do not have an American SSN number as I am not a US citizen and I have never worked in the States. After speaking g with her supervisor she said that she would pass the call to a teller. The call transfer did not go through as I got a recorded message saying that the teller was busy and asked me to call later. I have no idea as to how to get the teller 's number, hence my contact with you. I can not believe that I am the only person trying to close an account who does not have an SSN number."
8283234,Credit reporting or other personal consumer reports,Credit reporting,Improper use of your report,Credit inquiries on your report that you don't recognize,AMERICAN EXPRESS COMPANY,CT,Web,Yes,N/A,2024-02-06,review_credit_reporting_dispute,451,"On XX/XX/XXXX XXXX XXXX XXXX XXXX did a credit inquiry on my credit report and I don't do business or permit them to pull my credit without my knowledge. 

American Express 2 inquiry on my credit report on XX/XX/XXXX didn't authorize them to pull my credit report. I have a credit freeze on my report. 

XXXX XXXX XXXX didn't authorize this inquiry on XX/XX/XXXX I have a security freeze on my credit report how are they able to go on my credit report"
3506117,"Credit reporting, credit repair services, or other personal consumer reports",Credit reporting,Improper use of your report,Reporting company used your report improperly,ALLY FINANCIAL INC.,CA,Web,Yes,N/A,2020-01-22,manual_agent_review,181,"I filed for Chapter XXXX and was Discharged however, my credit score recently dropped due to XXXX XXXX XXXX, Ally Financial, XXXX  XXXX XXXX, XXXX still reporting on my credit file."
6276548,"Money transfer, virtual currency, or money service",Mobile or digital wallet,"Managing, opening, or closing your mobile wallet account",,"Paypal Holdings, Inc",,Web,Yes,N/A,2022-12-03,manual_agent_review,1283,"my names XXXX XXXX XXXX. i noticed in XX/XX/XXXX that my paypal account was limited they asked me to submit a bank statement which they confirmed they accepted as well as a photo id of a drivers license, they said it the id i sent and the name on the paypal account didnt match which i found weird i thought maybe i had sent in the wrong id since i also have my daughter 's ID on my phone. a day after paypal permanently limited my paypal account due to inconsistency with user agreement, i had a balance of XXXX on my account which thy have been not allowing me to withdraw since the end of XXXX. i have contacted paypal on the phone they and got different answers from different people i spoke to so i was unsure what was going on they referred me to to a new method of submitting the proof of ID, this time i made sure i sent the right one however they still denied my appeal ( XX/XX/XXXX ) and refused to remove the limitation i have contacted them almost everyday and none of them still have been able to help me, they want to hold my money for 180 days before the funds are released to me and there is even a chance the money will be kept by the them, i find this to be very unfair practices an"
3714345,Credit card or prepaid card,General-purpose credit card or charge card,Problem with a purchase shown on your statement,Credit card company isn't resolving a dispute about a purchase on your statement,"CITIBANK, N.A.",IN,Web,Yes,N/A,2020-06-24,investigate_billing_or_transaction,1154,"On XX/XX/XXXX I purchased 5 concert tickets for a XXXX XXXX and XXXX XXXX Concert to be held in XX/XX/XXXX for {$1600.00}. This included meeting and greeting the performers and a photo with the performers. Because of the COVID-19 situation and the statewide ban on gatherings such as this, the concert can not happen and did not happen. Further, meeting and greeting a performer is no longer going to be possible at all. I asked the merchant, XXXX for a refund, but they claim that the concert is not cancelled, but postponed indefinitely. If the concert was cancelled, it would be refunded. Their website, as I recall, claimed to have extensive buyer protections. That's obviously false. I have a document from XXXX ( attached ) that seems to state that the concert will happen in XXXX!!!! This is ridiculous. Concerts are essentially illegal right now and rescheduling 3 years into the future is beyond ridiculous. I just want my money back. They did not provide the service I paid for and I need this money returned. I contacted Citi and disputed this charge, but Citi found in favor of the merchant that can not provide me with the services promised."
8008540,Credit reporting or other personal consumer reports,Credit reporting,Improper use of your report,Credit inquiries on your report that you don't recognize,"EQUIFAX, INC.",IN,Web,Yes,N/A,2023-12-15,escalate_for_fraud_review,369,"CFPB- 15 U.S. Code $ 1681c-2 a consumer reporting agency shall block the reporting of any information in the file of a consumer that the consumer identifies as information that resulted from an alleged identity theft, not later than 4 business days after the date of receipt. I HAVE ATTACHED MY FTC REPORT TO THIS COMPLIANT TO PREVENT FURTHER STALL TACTICS FROM EQUIFAX"
3723846,"Credit reporting, credit repair services, or other personal consumer reports",Credit reporting,Problem with a credit reporting company's investigation into an existing problem,Their investigation did not fix an error on your report,"EQUIFAX, INC.",FL,Web,Yes,N/A,2020-07-01,escalate_for_fraud_review,1206,"see attatched Equifax XX/XX/XXXX referencing SECTION 605 B c of Fair Credit Act DENYING MY REQUEST FOR VERIFICATION. Please explain the allegation of ( B ) Basis of material misrepresentatation of fact by consumer.?? WHAT MATERIAL MISREPRESENTATION OF FACT IS EQUIFAX ACCUSING ME OF?? I DID NOT OPEN THE XXXX VISA ACCOUNT. Provide verification this visa was opened by me OR DELETE. See attatched XXXX 1099-C CANCELLATION OF DEBT XX/XX/XXXX ( * VISA XXXX DEBT it was both? 
But canceled XX/XX/XXXX. Account XXXX. ) This was a mastercard CANCELLED DEBT ) It turned into a Visa Card ( 4 ) Years later XXXX Without my Knowledge. See attatched XXXX XXXX VISA card ending XXXX CREDIT CARD FRAUD CLAIM {$470.00} UNAUTHORIZED TRANSACTIONS XX/XX/XXXX dated XX/XX/XXXX Fraud Claim Date XX/XX/XXXX. VISA end XXXX Had Unauthorized Transactions the first time I used it. I DID NOT APPLY FOR THIS CARD BUT USED IT WITHOUT KNOWING I DID NOT OPEN THIS ACCOUNT. See attatched XX/XX/XXXX United States Inspection Service ( Deliveries Not Made by USPS. Per Mail Rule ) Please Provide Verification ORIGINAL SIGNATURE PROOF DELIVERY the ITEMS WERE DELIVERED INTO MY HANDS on XXXX & XXXX  ACCOUNTS. that I was charged OR D"
8867896,Credit reporting or other personal consumer reports,Credit reporting,Improper use of your report,Reporting company used your report improperly,"BANK OF AMERICA, NATIONAL ASSOCIATION",FL,Web,Yes,N/A,2024-04-26,escalate_for_manager_or_compliance_review,1985,"XXXX XXXX XXXX XXXX XXXX XXXX XXXX  XXXX XXXX XXXX XXXX XXXX, XXXX XXXXXXXX XX/XX/2020 XXXX XXXX XXXX XXXXXXXX XXXX XXXX XXXX XXXX XXXX  XXXX RE : Consumer ID # XXXX Ref # XXXX Dear XXXX XXXX XXXX : I have received your recent response to my initial inquiry and request for verification of Account Abuse/unpaid ( {$150.00} ) from Bank Of America XXXX Be advised that your response is inadequate for the purposes of valid verification. You have failed to provide any documentation to corroborate the claim that I have Account Abuse from Bank Of America. 
Therefore, I am resubmitting my request to include the following specifics that I require from you : Copies of signed documents provided by Bank of America. These documents should bear my signature and clearly state that I have a legally binding and contractual obligation to pay them. 
The full names, addresses, and direct telephone numbers for each of the individuals at Bank Of America that you contacted in the course of your investigation Please also be advised that a verbal confirmation from Bank Of America does not suffice as proof of validation. If this matter is not resolved within the next fifteen ( XXXX ) business days, I will tak"
3402371,Mortgage,Conventional home mortgage,Applying for a mortgage or refinancing an existing mortgage,,"Rocket Mortgage, LLC",IN,Web,Yes,N/A,2019-10-11,review_mortgage_servicing_case,1848,"I applied for a refinance with Quicken loans in mid XXXX. I was told the terms would be 3.99 % {$100000.00} loan with 2.125 % points, with those terms, I agreed to put a "" good faith deposit '' down of {$500.00} ( no one from Quicken told me that they could change the rates and terms after I put the deposit down ). Our appraisal came back at {$140000.00} and all of the sudden all rates and terms changed. ( I went to XXXX XXXX Mortgages and once again had an appraisal done 1 week later and it was {$160000.00}, {$37000.00} more! ). Anyway, Quicken changed my rates and terms no less than 5 times, even changing terms 2 times in one day! I thought good faith meant good faith by both parties. Their actions were not fair and entirely too confusing. Even my loan officer said she did not know what was going on. Of course, I no longer felt comfortable letting this company deal with my mortgage so I went to Ruoff and closed within a few weeks with no issues, but I am now out {$500.00} with Quicken and they refuse to return it. During this process, we also received calls from several different people from Quicken after we told them that we no longer wanted to work with them and some were even "
8138451,Checking or savings account,Savings account,Managing an account,Deposits and withdrawals,BMO BANK NATIONAL ASSOCIATION,VA,Web,Yes,N/A,2024-01-10,manual_agent_review,1447,"BMO bank verified me over the phone for almost 3 hours. They then called me the next day and requested my bank information over the phone. They told that I had to deposit a certain amount in both accounts. After that verified me for almost 3 hours and took some of my money from my old account they locked my accounts and then said they could verify me. They then turned mean, and rude. With this account you get a bonus if you transfer a certain amount. I find that these banks including BMO try to get you to open a account for their investors then they make it difficult for you access your account. They then started complaining about people trying to steal their money. However, I have to put money in the account and keep it there for months before I would get a bonus. After they took my money they refused to allow me access to my money. They had verified for hours. Then I stayed on the phone for days trying to access my funds. They then became very mean and refused to help me access my money unless I got forms signed and notarized which I did. Then no one from BMO called nor apologized to me!!! The last person I spoke with in their customer service had some very strange sound in the b"
3429330,"Credit reporting, credit repair services, or other personal consumer reports",Credit reporting,Incorrect information on your report,Information belongs to someone else,"TRANSUNION INTERMEDIATE HOLDINGS, INC.",TX,Web,Yes,N/A,2019-11-05,review_credit_reporting_dispute,657,"XXXX  XXXX XXXX is being reported on my XXXX, Transunion, and XXXX  credit reports. This account is a fraudulent account and documentation has been sent to the reporting agencies stating that i was a victim of ID theft and that this account does not belong to me and should be immediately suppressed and blocked from my report. All agencies have stated the verified this belongs to me without providing any type of documentation that shows I opened the account and signed up for the accounts. This documentation was sent over to all agencies by me from XX/XX/XXXX to XX/XX/XXXX but they have yet to verify with documentation that they accounts belong to me."
3531487,Mortgage,Conventional home mortgage,Applying for a mortgage or refinancing an existing mortgage,,"Shellpoint Partners, LLC",CA,Web,Yes,N/A,2020-02-13,review_mortgage_servicing_case,1524,"I successfully completed, signed and notarized a loan modification with Shellpoint Mortgage in XX/XX/XXXX. In XX/XX/XXXX the loan was transferred to another servicer, XXXX XXXX XXXX. As XX/XX/XXXX my modification has not been completed. My loan is in limbo and I have been making payments that are not credited to my loan. I call both companies and everyday. XXXX told me today XX/XX/XXXX that they can not get the terms of the loan to match the terms that Shellpoint sent. XXXX says Shellpoint is not responding, Shellpoint says XXXX has everything they need. 

Originally, I was told that in order to start the trial modification I would need to pay {$10000.00} prior to the first payment in XX/XX/XXXX. In XX/XX/XXXX I expressed my concern about paying {$10000.00} essentially a down payment that was not noted in the agreement. There was no mention of the {$10000.00} anywhere, I went out of my way to continue to tell Shellpoint that this didn't seem right. Well my fears are now validated because XXXX indicates the {$10000.00} is the very reason they can not process my loan - because the {$10000.00} was not spelled out in the modification paperwork as a down payment - it is essentially show"
8059256,Credit reporting or other personal consumer reports,Credit reporting,Improper use of your report,Reporting company used your report improperly,"EQUIFAX, INC.",TX,Web,Yes,N/A,2023-12-27,manual_agent_review,1018,"In accordance with the Fair Credit Reporting act. The List of accounts below has violated my federally protected consumer rights to privacy and confidentiality under 15 USC 1681. 

Account name : # XXXX, Account name : # XXXX, Account name : # XXXX, Account name : # XXXX, has violated my rights. 

15 U.S.C 1681 section 602 A. States I have the right to privacy.

15 U.S.C 1681 Section 604 A Section 2 : It also states a consumer reporting agency can not furnish a account without my written instructions 15 U.S.C 1681c. ( a ) ( 5 ) Section States : no consumer reporting agency may make any consumer report containing any of the following items of information Any other adverse item of information, other than records of convictions of crimes which antedates the report by more than seven years.

15 U.S.C. 1681s-2 ( A ) ( 1 ) A person shall not furnish any information relating to a consumer to any consumer reporting agency if the person knows or has reasonable cause to believe that the information is inaccurate."
3494220,"Credit reporting, credit repair services, or other personal consumer reports",Credit reporting,Incorrect information on your report,Information belongs to someone else,"TRANSUNION INTERMEDIATE HOLDINGS, INC.",FL,Web,Yes,N/A,2020-01-13,escalate_for_fraud_review,549,"I HAVE REVIEWED MY CREDIT REPORT AND FOUND AN INACCURATE ACCOUNTS ON MY FILE. THESE NEGATIVE ACCOUNTS HAVE CAUSED TREMENDOUS HARDSHIP ON MY CREDIT. I FEEL LIKE I'M HELPLESS BECAUSE I HAD NO KNOWLEDGE OF THE ACCOUNTS. I HAVE NO IDEA WHO WOULD HAVE MY PERSONAL INFORMATION ON HAND AND CAUSED A GREAT HARM TO MY CREDIT, BECAUSE OF THIS IT IS NOW HARD TO ACQUIRE NEW CREDIT. I AM REQUESTING A RE-INVESTIGATION INTO THIS MATTER AND I WOULD LIKE THESE NEGATIVE ACCOUNTS OFF MY CREDIT FILE. PLEASE KEEP IN MIND THAT THOSE ACCOUNTS WAS NOT AUTHORIZED BY ME."
8029258,Credit reporting or other personal consumer reports,Credit reporting,Improper use of your report,Reporting company used your report improperly,Experian Information Solutions Inc.,GA,Web,Yes,N/A,2023-12-19,review_credit_reporting_dispute,2007,"This letter is to formally notify you per the Fair Credit Reporting Act 15 USC 1681 section 602 a states "" There is a need to insure that consumer reporting agencies exercise their grave responsibilities with fairness, impartiality, and a respect for the consumers right to privacy. '' XXXX, XXXX and Experian are consumer reporting agencies and I am the Consumer. XXXX XXXX XXXX XXXX is a financial institution by definition under 15 USC 6801. 15 USC 6802 ( b ) ( c ) states that "" A financial institution may not disclose nonpublic personal information to a nonaffiliated third party unless the consumer is given an explanation of how the consumer can exercise that nondisclosure option. XXXX XXXX XXXX XXXX never informed me of my right to exercise my nondisclosure option. Pursuant to FCRA 15USC 1681a ( 2 ) a consumer report does not contain or include any ( i ) report containing information solely as to transactions or experiences between the consumer and the person making the report. 

The law states that it is illegal to report Transaction history. 15 U.S. Code 1681n - Civil liability for willful noncompliance ( a ) In general Any person who willfully fails to comply with any requireme"
3724211,Debt collection,Payday loan debt,False statements or representation,Attempted to collect wrong amount,"Security Credit Services, LLC",MD,Web,Yes,N/A,2020-06-30,manual_agent_review,338,"In the month of XXXX, I called the creditor XXXX to request a proof of balance, a contract that would make me liable for the debt, and as well as a 1099 for the balance. This was asked to validate the debt they claimed I owed them. In regards to the information I requested, they were unable to provide with any documentation I requested."
8114310,Credit reporting or other personal consumer reports,Credit reporting,Improper use of your report,Reporting company used your report improperly,"EQUIFAX, INC.",NY,Web,Yes,N/A,2024-01-06,manual_agent_review,727,"In accordance with the Fair Credit Reporting act XXXX XXXX XXXX XXXX  ACCOUNT # XXXX, has violated my rights. 

In accordance with the Fair Credit Reporting act XXXX XXXX XXXX ACCOUNT # XXXX, has violated my rights. 

In accordance with the Fair Credit Reporting act XXXX  XXXX XXXX ACCOUNT # XXXX, has violated my rights. 

In accordance with the Fair Credit Reporting act XXXX XXXX XXXXXXXX, has violated my rights. 

In accordance with the Fair Credit Reporting act XXXX XXXX XXXX XXXX XXXX, has violated my rights. 

15 U.S.C 1681 section 602 A. States I have the right to privacy.

15 U.S.C 1681 Section 604 A Section 2 : It also states a consumer reporting agency can not furnish a account without my written instructions"
3457139,"Credit reporting, credit repair services, or other personal consumer reports",Credit reporting,Incorrect information on your report,Information belongs to someone else,"TRANSUNION INTERMEDIATE HOLDINGS, INC.",CA,Web,Yes,N/A,2019-12-03,escalate_for_fraud_review,32,I am a victim of identity theft.
8266742,"Money transfer, virtual currency, or money service",Virtual currency,Fraud or scam,,JPMORGAN CHASE & CO.,FL,Web,Yes,N/A,2024-02-01,manual_agent_review,229,"XXXX XXXX2023, I fell victim to two multi-layered scam operations run by XXXX which involved me making deposits for a total amount of XXXX USD from my XXXX  XXXX XXXX account to JPMorgan Chase at the instructions of the scammers."
3216439,Mortgage,VA mortgage,Struggling to pay mortgage,,Mr. Cooper Group Inc.,MD,Web,Yes,N/A,2019-04-18,review_mortgage_servicing_case,1250,I have applied for a mortgage modification because I have fallen behind on my payments due to my wife and I losing our jobs. I have since been able to make my payments but I can not catch them up. I can not afford payment arrangements because the mortgage servicer Mr. Cooper will not spread them out over a long enough period of time. 5 months ago I applied for the modification and provided all required documents at that time. The underwriter did not read all of the documents provided and requested the same documents over again with no explanation as to what was wrong with what was provided. In late XXXX I spoke to their customer service agent whom went over the documents I provided with me and stated all required documents where there. The underwriter reissued the same request for documents in XXXX. I called and spoke to the customer service representative again and they stated they saw that the documents were uploaded. Meanwhile I have been making monthly payments keeping the mortgage from going 90 days delinquent. This continued through XXXX when on the XXXX I went and uploaded all new documents for review and went over such documents with customer service. There has been no revi
