complaint_id,product,sub_product,issue,sub_issue,company,state,channel,timely_response,consumer_disputed,date_received,compliance_signal,narrative_length,narrative_preview
6688812,Debt collection,I do not know,Attempts to collect debt not owed,Debt is not yours,LJ Ross Associates,PA,Web,Yes,N/A,2023-03-14,legal_risk,3095,"L.J. ROSS & ASSOCIATes falsely accessed my consumer file fraudently without permission nor permissable purpose. 1. Provide validation of the debt, that is, the actual accounting.

2. Verification of their claim against you, that is, a signed Invoice. 
3. A copy of the Contract binding both parties ( you and them ), and send that letter by recorded delivery so that there is an independent witness to it having been delivered. '' This letter is to inform you that the above referenced accounts being reported by your company on my credit reports is hereby disputed for lack of completeness and/or accuracy. I have recently opted out from all secondary credit reporting so please do not rely on them for accuracy for they should not be sharing any of my information. 



I recently tried to verify these accounts with the credit reporting bureaus. You have yet to provide proof other than word of mouth. Where are the documents and authorizations for these accounts? 



I am disputing the following information directly with you, the furnisher of information, and I am requesting that you conduct a full investigation and provide me with the documents showing where these accounts originate. Please "
5475547,"Credit reporting, credit repair services, or other personal consumer reports",Credit reporting,Incorrect information on your report,Information belongs to someone else,Experian Information Solutions Inc.,FL,Web,Yes,N/A,2022-04-20,legal_risk,972,"My name is XXXX XXXX this complaint is not made in error neither is it being made by a third party. I declare under penalty of perjury ( under the laws of the United States, if executed outside of the United States ) that the foregoing is true and correct to the best of my knowledge. Further, I certify that I am permitted by FEDERAL and STATE LAW to file this dispute. I also understand that knowing and willful misstatements or omissions of material facts constitutes a FEDERAL CRIMINAL VIOLATION punishable under 18 U.S.C. 1001. Additionally, these misstatements are punishable as perjury under 18 U.S.C. 1621. The items found within my credit report that I listed on the following pages are not related to any transaction that I made. I am alleging that a person or company- without my authorization- used my personal identifying information to apply for goods, services, or money ; and, was successful in creating some accounts. All is being investigated by the FTC."
7322172,"Credit reporting, credit repair services, or other personal consumer reports",Credit reporting,Incorrect information on your report,Information belongs to someone else,Experian Information Solutions Inc.,FL,Web,Yes,N/A,2023-07-29,legal_risk,960,"It appears that my credit file has been compromised. Again, I was going through my records & noticed many items which do not belong to me. Since Im a stickler for research, I found that under section 605b of the FCRA you are required by law to remove & block any items which are found to be opened due to identity theft. The dispute items do not belong to me. Im attaching the required FTC Report for you ( learned through more research both parties require ). Please block/remove these files. 
XXXX XXXX XXXX XXXX XXXX XXXX XXXX, FLXXXX ; XXXX XXXX XXXX XXXX XXXX XXXX, FLXXXX ; XXXX XXXX XXXX XXXX XXXX XXXX XXXX XXXX, FLXXXX ; XXXX XXXX XXXX XXXX XXXX, FL XXXX ; XXXX XXXX XXXX XXXX XXXX, FLXXXX ; XXXX XXXX XXXX XXXX, FLXXXX ; XXXX XXXX Balance Owed : {$8600.00} ; XXXX XXXX XXXX Balance Owed : {$12000.00} ; XXXX XXXX XXXX Balance Owed : {$35000.00} ; XXXX XXXX XXXX XXXX Balance Owed : {$100000.00} ; XXXX XXXX Balance Owed : {$880.00} ; XXXX XX/XX/2022."
15427704,Credit reporting or other personal consumer reports,Credit reporting,Problem with a company's investigation into an existing problem,Investigation took more than 30 days,"Portfolio Recovery Associates, LLC",VA,Web,Yes,N/A,2025-08-22,legal_risk,452,"On XX/XX/XXXX I sent a certified letter for validation of a debt to Portfolio Recovery Associates , LLC. A debt bought from XXXX XXXX, XXXX. I was sent a generic billing statement which doesn't provide validation of the debt. I asked for a Original contract bearing my signature the Forward Flow, chain of title and Legal Authorization and Compliance and and a complete itemization of accounting charges of the alleged debt. I received a mere response."
16204944,Credit reporting or other personal consumer reports,Credit reporting,Incorrect information on your report,Information belongs to someone else,"TRANSUNION INTERMEDIATE HOLDINGS, INC.",NJ,Web,Yes,N/A,2025-09-26,legal_risk,1518,"This CFPB complaint has been filed to request pursuant to FCRA 605B ( 15. U. S. C.

1681c2 ) that you, the TransUnion credit reporting agencys block the information appearing on my consumer credit report that is the result of identity theft, and fraud within four business days of you receiving this complaint. This fraudulent, inaccurateand false information consist of personal credit card accounts, auto loans, personal loansand open end unsecured consumer accounts as follows : ACCOUNTS : XXXX XXXX - Account Number : XXXX XXXX XXXX XXXX XXXX XXXXXXXX, Date Opened : XX/XX/year>, Balance : {$1700.00} These accounts have resulted in several fraudulent hard inquiries and fraudulent collections appearing on my consumer FICO credit report. Ive attached a list of the hard inquiries in question as well as a copy of the consumer FICO credit report maintained by you which shows the said fraudulent items. I do not recognize these accounts, collections and hard inquiries as reported. The aforementioned accounts, collections and hard inquiries appearing on my consumer credit report maintained by you were not opened, made or initiated by me. 
All of the said accounts, collections and hard inquiri"
12618073,Credit reporting or other personal consumer reports,Credit reporting,Improper use of your report,Reporting company used your report improperly,"TRANSUNION INTERMEDIATE HOLDINGS, INC.",OH,Web,Yes,N/A,2025-03-24,legal_risk,1145,"XXXX XXXX XXXX XXXX XXXX XXXX Ohio, XXXX XXXX XXXX XXXXXX/XX/year> Consumer Financial Protection Bureau XXXXXXXX XXXX XXXX XXXX XXXX XXXX XXXXXXXX Subject : Request for Removal of Inquiries on TransUnion Report Dear Consumer Financial Protection Bureau, I am writing to formally request your assistance regarding unauthorized inquiries on my TransUnion credit report. I recently reviewed my credit report and noticed the following inquiries that I believe should be removed : XXXX. XXXX XXXX - Date : XX/XX/year> These inquiries were made without my permission, and I have already filed a report with the Federal Trade Commission ( FTC ) to address this issue. I am concerned that these inquiries may negatively impact my credit score and overall financial standing. I kindly request that you investigate this matter and take appropriate action to have these unauthorized inquiries removed from my credit report. I have included a copy of my FTC report for your reference, as well as any pertinent information needed to process my request. Thank you for your attention to this matter. I look forward to your prompt response. Sincerely, XXXX XXXX"
10911650,Debt collection,I do not know,False statements or representation,Attempted to collect wrong amount,Resurgent Capital Services L.P.,MS,Web,Yes,N/A,2024-11-23,legal_risk,1823,"Please be advised this is NOT a refusal to pay, but a notice sent pursuant to the FAIR DEBT COLLECTION PRACTICES ACT 15 USC 1692g stating your claim is disputed and validation is requested.

This is NOT request for "" verification '' or proof of my mailing address, but a request for VALIDATION made pursuant to the above named Title and Section. I respectfully request your office provide me with competent evidence that I have a legal obligation to pay you. 
At this time, I will also inform you that if your offices have reported invalidated information to any of the XXXX major bureaus ( XXXX, XXXX, or XXXX ) this action may consult in fraud under both Federal and State laws. Due to this fact, if any negative mark is found on my credit reports by your company, or the company that you represent, I will not hesitate in bringing in legal action against you and your client forbthe following : Violation of the Fair Credit Reporting Act, Violation of the fair Debt Collection Practices Act, and Defamation of Character.

If your offices are able to provide the proper documentation as requested in the following Declaration, I will require at least 30 days to investigate this information, during"
17637534,Credit reporting or other personal consumer reports,Credit reporting,Improper use of your report,Reporting company used your report improperly,"TRANSUNION INTERMEDIATE HOLDINGS, INC.",IL,Web,Yes,N/A,2025-12-01,legal_risk,533,"You have reported inaccurate and unauthorized accounts on my credit report, which is a violation of the Fair Credit Reporting Act ( 15 U.S. Code 1681i ) requiring a proper reinvestigation of disputed items, and 1681e ( b ), which mandates maximum possible accuracy. These false entries are damaging and unjust, especially since Ive never opened or authorized these accounts. If you fail to investigate and correct this, I may pursue legal action under the FCRA and FDCPA ( 15 U.S. Code 1692e ) for deceptive and misleading reporting."
9884005,Credit reporting or other personal consumer reports,Credit reporting,Incorrect information on your report,Information belongs to someone else,Experian Information Solutions Inc.,CA,Web,Yes,N/A,2024-08-22,legal_risk,595,"Im submitting a complaint to you today to inform you I was the victim of identity theft. I researched on how to remove the fraudulent items in my report and found that I need to visit FEDERAL TRADE COMMISION or https : //www.ftc.gov to file a report and Per FCRA section 605b Credit Reporting Agencies are required to remove/block any items listed on an id theft report. Please find the ATTACHED documents to assist in the blocking of the erroneous information which is being posted to my report. 

XXXX XXXX XXXX {$0.00} XXXX XXXX XXXX  Balance {$0.00} XXXX XXXX XXXX XXXX XXXX  XXXX {$7500.00}"
9314229,Credit reporting or other personal consumer reports,Credit reporting,Incorrect information on your report,Information belongs to someone else,"TRANSUNION INTERMEDIATE HOLDINGS, INC.",CA,Web,Yes,N/A,2024-06-22,legal_risk,965,"Im submitting a complaint to you today to inform you I was the victim of identity theft. I researched on how to remove the fraudulent items in my report and found that I need to visit FEDERAL TRADE COMMISION or https : //www.ftc.gov to file a report and Per FCRA section 605b Credit Reporting Agencies are required to remove/block any items listed on an id theft report. Please find the ATTACHED documents to assist in the blocking of the erroneous information which is being posted to my report.

Here is the list of items which do not belong to me or were opened without my permission. 

XXXX XXXX XXXX XXXX XXXX, CA XXXX XXXX XXXX AV XXXX XXXX XXXX XXXX CA XXXX XXXX XX/XX/XXXX XXXX XX/XX/XXXX According to FCRA Section 605B ( a ) the CREDIT REPORTING AGENCIES shall block any information in the file of a consumer that the consumer identifies as information that resulted from an alleged identity theft, not later than 4 business days after the date of receipt."
10735345,Mortgage,FHA mortgage,Trouble during payment process,Trying to communicate with the company to fix an issue while managing or servicing your loan,"Shellpoint Partners, LLC",GA,Web,Yes,N/A,2024-11-08,legal_risk,3481,"On or about XX/XX/XXXX the lender force insured my home locking me out of the account 3 months prior stating that the account was under fraud and there was no insurance on the home. The lender had just received about {$38000.00} from the mortgage assistance program I applied to but stated they had no record of my existence. I was able to again prove that I was the POA on the account and the successor of the estate since my mother had passed away during XXXX. My documents were processed and I received confirmation from the lender/servicer. On XX/XX/XXXX my SPOC ( Single Point of Contact ) began taking through a modification to bring loan current because during the locking of the account I was unable to pay on it per the insurance side of the mortgage company. On XX/XX/XXXX I received notification from XXXX XXXX that ( Shellpoint Mortgage Servicing has reviewed your successor in interest claim and documentation submission on the above referenced account. We have confirmed you as a successor in interest to the property, and we are now able to discuss matters concerning the account and options available to you. ) He then made an in person appointment for me in XX/XX/XXXX where I turned"
13334733,Credit reporting or other personal consumer reports,Credit reporting,Problem with a company's investigation into an existing problem,Their investigation did not fix an error on your report,Experian Information Solutions Inc.,GA,Web,Yes,N/A,2025-05-05,legal_risk,1543,"I am submitting this complaint against both XXXX XXXX XXXX and Experian due to the ongoing reporting and mishandling of an account I never authorized or verified, Account # XXXX. 

I am filing this complaint against both XXXX XXXX XXXX and Experian for their continued reporting of an unverified and disputed debt, in violation of the Fair Debt Collection Practices Act ( FDCPA ) and the Fair Credit Reporting Act ( FCRA ). 

On XX/XX/XXXX, I submitted a formal debt validation request to XXXX  regarding Account # XXXX, invoking my rights under 15 U.S.C. 1692g and 12 CFR 1006.34. I requested verifiable proof of the debt, including a signed agreement and itemized payment history.

Instead of providing a signed contract or valid documentation that meets legal standards for debt validation, XXXX  responded on XX/XX/XXXX with unsigned generic documents ( Truth in Lending Disclosure and a Loan Verification Letter ). These do not constitute legal validation of the debt. 

Despite this, XXXX has continued to report the account to Experian, who in turn claims the information was verified without conducting a proper reinvestigation as required under 15 U.S.C. 1681i. This is a clear violation of "
4516979,"Money transfer, virtual currency, or money service",Money order,Fraud or scam,,NAVY FEDERAL CREDIT UNION,TX,Web,Yes,N/A,2021-07-06,legal_risk,2241,"I applied for job on XXXX for an XXXX XXXX position for a school. The listing was taken off the website, so I figured someone took the position, however, a person named XXXX emailed me and said she would send my email to a partner for a XXXX XXXX job. The job described that I would be running personal errands and the money would be for donations ranging from foster care to invoices to colleagues. We exchange information and the partner of the school said I was to start the following week, which was the week of the XXXX of XXXX. On the XXXX, the first purchase was for a XXXX XXXX XXXX for XXXX, and yesterday for a XXXX money order which was split into 3 orders : 2 for {$1000.00}, 1 for XXXX. I got an inkling to check my bank account, only to see it was overdrawn. I called my bank and they notified me that the check bounced. I did further research to see if any other XXXX XXXX  jobs had the same format of wanting to have people be XXXX XXXX for approx, 30 hours per week and for a set price per week, and for helping donate to foster care systems, to which I found plenty. I also went ahead called the school district, XXXX XXXX XXXX to verify if they were the ones who hosted the job lis"
14244788,Credit reporting or other personal consumer reports,Credit reporting,Improper use of your report,Reporting company used your report improperly,Experian Information Solutions Inc.,FL,Web,Yes,N/A,2025-06-23,legal_risk,518,"I have submitted multiple formal dispute letters to Experian Information Solutions Inc. regarding inaccurate and unverifiable information on my credit report ( see attached copies ). Despite clear legal notice, Experian Information Solutions Inc. continues to willfully report inaccurate data in violation of FCRA 15 U.S.C. 1681e ( b ), 1681i, and FDCPA 1692e and 1692f. I have exhausted all attempts to resolve this matter directly with the credit bureau. I now request the CFPB to investigate and enforce compliance."
13120037,Credit reporting or other personal consumer reports,Credit reporting,Improper use of your report,Reporting company used your report improperly,Experian Information Solutions Inc.,TX,Web,Yes,N/A,2025-04-22,legal_risk,533,"You have reported inaccurate and unauthorized accounts on my credit report, which is a violation of the Fair Credit Reporting Act ( 15 U.S. Code 1681i ) requiring a proper reinvestigation of disputed items, and 1681e ( b ), which mandates maximum possible accuracy. These false entries are damaging and unjust, especially since Ive never opened or authorized these accounts. If you fail to investigate and correct this, I may pursue legal action under the FCRA and FDCPA ( 15 U.S. Code 1692e ) for deceptive and misleading reporting."
7528097,Credit reporting or other personal consumer reports,Credit reporting,Problem with a company's investigation into an existing problem,Their investigation did not fix an error on your report,"TRANSUNION INTERMEDIATE HOLDINGS, INC.",GA,Web,Yes,N/A,2023-09-10,legal_risk,32545,"Transunion and XXXX continue to report inaccurate information listed on the account XXXX XXXX Account # XXXX. 

Last Verified : XX/XX/XXXX -- Date of Last Activity : XX/XX/XXXX XX/XX/XXXX Date Opened : XX/XX/XXXX XX/XX/XXXX Payment Status : Late 120 Days Late 150 Days 15 U.S. Code 1681 - Congressional findings and statement of purpose ( a ) Accuracy and fairness of credit reporting The Congress makes the following findings : ( 1 ) The banking system is dependent upon fair and accurate credit reporting. Inaccurate credit reports directly impair the efficiency of the banking system, and unfair credit reporting methods undermine the public confidence which is essential to the continued functioning of the banking system. 
( 2 ) An elaborate mechanism has been developed for investigating and evaluating the credit worthiness, credit standing, credit capacity, character, and general reputation of consumers.

( 3 ) Consumer reporting agencies have assumed a vital role in assembling and evaluating consumer credit and other information on consumers.

( 4 ) There is a need to insure that consumer reporting agencies exercise their grave responsibilities with fairness, impartiality, and a respe"
12439799,Credit reporting or other personal consumer reports,Credit reporting,Incorrect information on your report,Information belongs to someone else,"EQUIFAX, INC.",OH,Web,Yes,N/A,2025-03-12,legal_risk,3703,"XXXX XXXX XXXX XXXX XXXX XXXX XXXX XXXX, Ohio XXXX XXXX XX/XX/XXXX Subject : Formal Dispute and Request for Debt Validation Violation of Title 15 U.S.C. 1681s-2, 1692c ( c ), and 605B Dear [ Credit Bureau Representative ], I am writing to formally dispute the accuracy and validity of certain debts and hard inquiries reported on my credit file. My personal information may have been compromised due to the Equifax, TransUnion, Experian, and XXXX data breaches, and I believe that fraudulent activity has occurred using my identity. 

Under The Doctrine of Estoppel by Silence ( XXXX XXXX XXXX ( XXXX  ) XXXX XXXX XXXX, XXXX ), I may presume that no proof of the alleged debts exists. Therefore, I request an immediate investigation and resolution of the following fraudulent items appearing on my credit report. 

I. Dispute of Hard Inquiries and Accounts Due to Identity Theft Based on my review, the following unauthorized hard inquiries have been reported on my credit file : XXXX. XXXX XXXX ( Auto ) - Inquiry Date : XX/XX/XXXX ( TransUnion Report ) XXXX. XXXX XXXX - Inquiry Date : XX/XX/XXXX ( Equifax Report ) Additionally, fraudulent accounts were opened in my name, as stated in my FTC Iden"
6094113,"Credit reporting, credit repair services, or other personal consumer reports",Credit reporting,Incorrect information on your report,Information belongs to someone else,"TRANSUNION INTERMEDIATE HOLDINGS, INC.",SC,Web,Yes,N/A,2022-10-17,legal_risk,315,I never open a XXXX  account. I contacted the creditor by mail and by email in XXXX and XXXX. Again recently in XXXX. I have contacted transunion no response. I would like for the information to be removed before exploring other remedies to bring legal action. This account was open during the XXXX security breach.
13479315,Credit reporting or other personal consumer reports,Credit reporting,Unable to get your credit report or credit score,Other problem getting your report or credit score,"CARRINGTON MORTGAGE SERVICES, LLC",CA,Web,Yes,N/A,2025-05-13,legal_risk,1835,"I am filing this complaint against Carrington Mortgage Services , LLC regarding their refusal to report my mortgage payment history to the three major credit bureaus ( XXXX, XXXX, and XXXX  ). Despite fulfilling my post-bankruptcy obligations, Carrington continues to withhold this critical reporting, which is harming my ability to rebuild credit. 

My XXXX  XXXX bankruptcy was filed on XX/XX/year> and discharged on XX/XX/year>. Carrington has confirmed that the lien on my property remains valid and that I am still obligated to make monthly payments. I have consistently made these payments for over 10 years post-discharge. However, Carrington claims they are no longer reporting to the credit bureaus because of the discharge this is inaccurate and misleading. 

Legal Grounds : Under the Fair Credit Reporting Act ( 15 U.S.C. 1681s-2 ), Carrington is obligated to ensure that any information it chooses to report is accurate and complete. The bankruptcy discharge relieved me of personal liability but did not remove the lien or the obligation to pay thus, the payment history is valid and reportable. 

Furthermore, their refusal to report this history may violate the Consumer Financial Pro"
5810430,"Credit reporting, credit repair services, or other personal consumer reports",Credit reporting,Incorrect information on your report,Information belongs to someone else,Kikoff Inc.,TX,Web,Yes,N/A,2022-07-26,legal_risk,1189,A line of credit was fraudulently opened in my name under the account title Kickoff Lending LLC in XXXX of XXXX. I contacted my bank ( XXXX identity theft department ) and started the process of disputing this claim. There were also several different inquiries and attempts etc. I also put a freeze with all XXXX credit agencies. I got the report back but did not notice that Kickoff Lending LLC apparently verified the account according to XXXX. I only noticed that the account was never removed when I received an alert that my credit score had changed. I then logged in to see that my credit score had dropped due to XXXX delinquent payments to the Kickoff Lending. It says I have a {$24.00} balance. I then started investigating this company and saw similar complaints with the exact dollar amount my account had. I have tried to contact this company but when you call the number it gives you an email address only. The email I tried to send was immediately sent back to me as a bad email account. I have filed a police report as well as a report with the XXXX XXXX XXXX. XXXX has told me this is my next step in hopes that you can contact the company as they also have been unable to.
14596751,Credit reporting or other personal consumer reports,Credit reporting,Problem with a company's investigation into an existing problem,Their investigation did not fix an error on your report,LEXISNEXIS,WI,Web,Yes,N/A,2025-07-11,legal_risk,3187,"FINAL REQUEST FOR DELETION & INVESTIGATION DEMAND Includes : Bankruptcy Case # XXXX and XXXX XXXX XXXX # XXXX CC : LexisNexis, XXXX XXXX XXXX XXXXXXXX XXXX XXXX XXXX XXXX XXXX XXXX XXXX XXXX, WI XXXX Email : XXXX Date : XX/XX/XXXX TO : LexisNexis XXXX XXXX XXXX. XXXX XXXX XXXX, GA XXXX CC : XXXX XXXX XXXX XXXX XXXX, TX XXXX XXXX XXXX. XXXX XXXX, XXXX, PA XXXX XXXX XXXXXXXX. XXXX XXXXXXXX, XXXX, GA XXXX XXXX XXXX. XXXX XXXX, XXXX, XXXX A XXXX Subject : FINAL DEMAND FOR DELETION Bankruptcy Case # XXXX and XXXX XXXX XXXX # XXXX To Whom It May Concern : This correspondence serves as a final legal demand to immediately remove the following unverifiable and damaging records from my consumer reports and data-sharing channels : Bankruptcy Case # XXXX XXXX XXXX XXXX # XXXX Your continued reporting of these accounts violates multiple provisions of the Fair Credit Reporting Act ( FCRA ), 15 U.S.C. 1681 et seq. The response provided under CFPB Complaint # XXXX admitted XXXX  was the sole verification source used a blatant violation, as XXXX  is not a furnisher of information and can not lawfully verify or report data under the FCRA. 
The inclusion of XXXX XXXX XXXX  # XXXX and its ongoing tran"
13457225,Debt collection,I do not know,Written notification about debt,Didn't receive notice of right to dispute,CL Holdings LLC,CA,Web,Yes,N/A,2025-05-13,legal_risk,348,"Account # XXXX ( Per XXXX  review ) Im unaware of this debt and did not have the opportunity to dispute this account. If you believe you sent proper notification, please provide 'Certified Mail ' with receipt displaying my Signature . If not, please delete this account # XXXX as soon as possible from my report or i will have to take legal action."
