complaint_id,product,sub_product,issue,sub_issue,company,state,channel,timely_response,consumer_disputed,date_received,next_best_action_candidate,narrative_length,narrative_preview
3642453,"Credit reporting, credit repair services, or other personal consumer reports",Credit reporting,Incorrect information on your report,Information belongs to someone else,Experian Information Solutions Inc.,NV,Web,Yes,N/A,2020-05-08,manual_agent_review,26,These are not my accounts.
8113747,Credit reporting or other personal consumer reports,Credit reporting,Incorrect information on your report,Information belongs to someone else,Experian Information Solutions Inc.,IL,Web,Yes,N/A,2024-01-05,review_credit_reporting_dispute,210,Kindly address this issue on my credit report. I assert that this account is not mine and believe it to be fraudulent. I urge you to correct this mistake and have provided supporting documents for verification.
3573294,"Credit reporting, credit repair services, or other personal consumer reports",Credit reporting,Incorrect information on your report,Information belongs to someone else,"EQUIFAX, INC.",NC,Web,Yes,N/A,2020-03-19,escalate_for_fraud_review,1139,"I wrote three requests, the unverified accounts listed below still remain on my credit report in violation of Federal Law. Equifax is under FCRA law to obtain the of the original creditors documentation on file to verify that this information is mine and is correct. I have already filed a FTC Report and Police Report. Who verified these accounts? You have NOT provided me a copy of ANY original documentation ( a consumer contract with my signature on it ) as required under Section 609 ( a ) ( 1 ) ( A ) & Section 611 ( a ) ( 1 ) ( A ). Furthermore you have failed to provide the method of verification as required under Section 611 ( a ) ( 7 ). Please be advised that under Section 611 ( 5 ) ( A ) of the FCRA you are required to promptly DELETE all information which can not be verified. 
The law is very clear as to the Civil liability and the remedy available to me ( Section 616 & 617 ) if you fail to comply with Federal Law. I am a litigious consumer and fully intend on pursuing litigation in this matter to enforce my rights under the FCRA. Please remove the following accounts : XXXX XXXX XXXX XXXX XXXX, XXXX XXXX XXXX   XXXX"
3414709,"Credit reporting, credit repair services, or other personal consumer reports",Credit reporting,Incorrect information on your report,Old information reappears or never goes away,Experian Information Solutions Inc.,HI,Web,Yes,N/A,2019-10-22,review_credit_reporting_dispute,307,XXXX XXXX has a old account settled in XXXX that keeps reappearing on my experian credit report and it now states its a debt from XXXX settled and XXXX balance. Its a total lie and incorrect. It was from XXXX settled way back then. It needs to be removed. Please make them remove it. Its effecting my score.
3584679,Student loan,Federal student loan servicing,Dealing with your lender or servicer,Keep getting calls about your loan,"Navient Solutions, LLC.",CA,Web,Yes,N/A,2020-03-29,manual_agent_review,65,They call at all hours and on the weekends using various numbers.
3569824,"Credit reporting, credit repair services, or other personal consumer reports",Credit reporting,Incorrect information on your report,Information belongs to someone else,"TRANSUNION INTERMEDIATE HOLDINGS, INC.",AR,Web,Yes,N/A,2020-03-17,review_credit_reporting_dispute,527,"I was recently going to check out a new car at XXXX. After carefully consideration I decided to apply for a loan for this car. Moments later I was decline for a lower interest rate and approved for an extremely high interest rate. Which promoted me to check my credit report. After doing so I notice a couple of items on my report that are not mine. These items need to be deleted from my credit report. 

XXXX XXXX XXXX {$140.00} XXXX  XXXX {$450.00} XXXX XXXX XXXX {$7800.00} XXXX   XXXX  XXXX {$370.00} XXXX XXXX {$10000.00}"
3442136,Credit card or prepaid card,General-purpose credit card or charge card,Problem with a purchase shown on your statement,Credit card company isn't resolving a dispute about a purchase on your statement,DISCOVER BANK,MA,Web,Yes,N/A,2019-11-18,investigate_billing_or_transaction,1113,"XXXX claimed they delivered a package to my address, which I never received Listed below are the delivery facts from the USPS regarding shipments XXXX & XXXX, with the supporting documentation enclosed. 

I. There was no signature II. The packages were delivered to zip code XXXX. 
a. There are XXXX souls living in XXXX dwelling units in ZIP code XXXX. 

XXXX provided no information that the package was delivered to my address, let alone signed by anyone. The only information provided shows that the packages were left at or near the mailbox in one of XXXX dwelling units. At or near mailbox does not indicate that the package was even placed inside of a secured area, let alone a secured area in my building. 

How am I being held responsible for a package for which there is no proof that I received? XXXX for a small fee, {$.00}, could have requested delivery confirmation from the USPS. This would have ensured that an authorized agent signed for the package. Alternately, XXXX could have ensured the packages for approximately {$4.00} each. 

There is no evidence to support that I received the packages."
3601853,Credit card or prepaid card,General-purpose prepaid card,Trouble using the card,Trouble getting information about the card,Netspend Corporation,IL,Web,Yes,N/A,2020-04-10,manual_agent_review,245,"I got a Brinks Money pre-paid card in the mail, assuming it was for my unemployment benefits. I tried activating and its requiring additional documents to be sent in. 
I attempted to call back and the number on the card seems to be disconnected."
3581699,"Credit reporting, credit repair services, or other personal consumer reports",Credit reporting,Incorrect information on your report,Account information incorrect,JPMORGAN CHASE & CO.,PA,Web,Yes,N/A,2020-03-26,review_credit_reporting_dispute,532,"I have filed a dispute in regards to the incorrect information that's on my credit report. Which relates to late payments. It has been well over 30 days, and I haven't received any investigation results. Listed below are the dates and amounts. 

Credit Bureau : XXXX  XXXX XXXX XX/XX/2019 XX/XX/2019 XXXX XXXX Monthly Payments XXXX XXXX XXXX XXXX  XX/XX/2019 XX/XX/2019 XX/XX/2019 XXXX XXXX  Monthly Payments XXXX XXXX XXXX XXXX   XX/XX/2019 XX/XX/2019 XXXX XXXX Monthly Payments XXXX/XXXX  XX/XX/201XXXX XXXX XXXX  Monthly Payments"
3421603,"Credit reporting, credit repair services, or other personal consumer reports",Credit reporting,Incorrect information on your report,Old information reappears or never goes away,"TRANSUNION INTERMEDIATE HOLDINGS, INC.",PA,Web,Yes,N/A,2019-10-29,manual_agent_review,342,There are five closed accounts from XXXX on my credit reports still that were closed in XXXX and XXXX. They are hurting my score and I have asked several times over the phone and in writing for them to be removed. The accounts have been resolved or paid for in other ways and there is no bearing for them to continue to remain on the account.
7970275,Credit reporting or other personal consumer reports,Credit reporting,Incorrect information on your report,Account status incorrect,Experian Information Solutions Inc.,PA,Web,Yes,N/A,2023-12-08,escalate_for_fraud_review,334,This is XXXX XXXX do not deny my complaint by stating that I filed this by some other means than myself.This is done 100 % by me. The stuff on my credit report is wrong and Under 15 U.S. Code 1681b Permissible purposes of consumer reports I never gave any written consent to report anything on my consumer reports no consent is fraud.
3065878,"Credit reporting, credit repair services, or other personal consumer reports",Credit reporting,Problem with a credit reporting company's investigation into an existing problem,Investigation took more than 30 days,SYNCHRONY FINANCIAL,SC,Web,Yes,N/A,2018-11-05,manual_agent_review,1086,"On XX/XX/2018 XXXX XXXX and XXXX XXXX were sent letters of validation via certified mail. The return receipts show XXXX XXXX 's letter was received by XX/XX/2018 and XXXX XXXX letter was received by XX/XX/2018. I heard no response from XXXX XXXX   until XXXX XXXX-which you can find in the attachments they provided in my last complaint made to them. Well pass the 30 days allotted by federal law to respond to a debt validation letter. XXXX XXXX sent a letter dated XX/XX/2018 but the post mark date reflects it being in the post office 's possession XX/XX/2018, per the corrected post mark date made by the postal service. In the envelope sent by XXXX XXXX they were requesting additional information 29 days after receiving the VOD letter and waited almost a week to send the letter off, which also shows lack of priority and willingness to follow federal law which states the company has 30 days from the date the letter is received to postmark a response. I filed a CFPB complaint and have contacted the 3 major credit reporting agencies of this neglect and the items still remain."
3377713,"Credit reporting, credit repair services, or other personal consumer reports",Credit reporting,Incorrect information on your report,Account status incorrect,"EQUIFAX, INC.",NY,Web,Yes,N/A,2019-09-17,escalate_for_fraud_review,369,"I Mr.XXXX XXXX is a victim of identity theft and accounts have been opened in my name as a result of identity theft ... 
XXXX  XXXX account # XXXXxxxxxxxxxxx opened XX/XX/XXXX amount {$23000.00}. 
Next account XXXX  XXXX original creditor XXXX XX/XX/XXXX amount {$750.00} And there is Inquiries : XXXX XXXX XXXX XXXX, XXXX XXXX XXXX XX/XX/XXXX XXXX XXXX/XXXX XX/XX/XXXX"
3597714,"Credit reporting, credit repair services, or other personal consumer reports",Credit reporting,Problem with a credit reporting company's investigation into an existing problem,Their investigation did not fix an error on your report,Experian Information Solutions Inc.,TX,Web,Yes,N/A,2020-04-08,escalate_for_fraud_review,496,"I notified Experian of an inaccuracy on my report by national credit adjust. This same account was reported to Experian by another company, XXXX XXXX XXXX XXXX which was deleted on XX/XX/2019 because it was proven invalid. Experian created what they called an investigation which lead to the incorrect/fraud info to remain on my report after they deleted this same info by another collection agency previously. This information is completely false and should not remain on my credit. Please help!"
8235233,Credit reporting or other personal consumer reports,Credit reporting,Improper use of your report,Credit inquiries on your report that you don't recognize,"TRANSUNION INTERMEDIATE HOLDINGS, INC.",CA,Web,Yes,N/A,2024-01-28,escalate_for_fraud_review,2153,"Urgent : Disputed Inquiries on Credit Report - Request for Validation Dear TransUnion and Consumer Financial Protection Bureau ( CFPB ), I am writing to express my dissatisfaction with the handling of my recent credit file dispute by TransUnion and to bring to your attention unauthorized inquiries on my credit report. 

I have recently submitted a dispute regarding inquiries on my credit file with TransUnion. The inquiries in question, listed below, were not authorized by me : XXXX XXXX XXXX XXXX XXXX XXXX - Inquiry Type : XXXX - XXXX Info : XXXX XXXXXXXX XXXX XXXX XXXX XXXX XXXXXXXX - Contact : XXXX XXXX XXXX XXXX XXXX XXXX XXXX XXXX XXXX XXXX XXXX XXXX  - Inquiry Type : XXXX - XXXX Info : XXXX XXXX XXXX XXXX XXXX XXXX - Contact : XXXX XXXX XXXX XXXX XXXX XXXX XXXX XXXX XXXX XXXX - Inquiry Type : XXXX XXXX XXXX Info : XXXX XXXX XXXX XXXX XXXX XXXX XXXX - Contact : XXXX XXXX XXXX XXXX XXXX XXXX XXXX XXXX - XX/XX/XXXX - Inquiry Type : XXXX - XXXX Info : XXXX XXXX XXXX XXXX XXXX XXXX XXXX XXXX - Contact : XXXX XXXX XXXX XXXX XXXX XXXX XXXX XXXX - XX/XX/XXXX - Inquiry Type : XXXX - XXXX Info : XXXX XXXX XXXX XXXX XXXX XXXX - Contact : XXXX XXXX XXXX XXXX I want to emphasize that I did"
3300820,Credit card or prepaid card,Store credit card,Problem with a purchase shown on your statement,Card was charged for something you did not purchase with the card,Nelson Cruz & Associates LLC,TN,Web,Yes,N/A,2019-07-09,escalate_for_fraud_review,895,"On XX/XX/XXXX I was called by a creditor Nelson Cruz and Associate they claimed I owed XXXX XXXX XXXX XXXX {$12000.00} from XXXX thru XXXX ... I never had a credit card with XXXX or applied for credit with them ... On XX/XX/XXXX I called XXXX XXXX XXXX XXXX and spoke in someone in customer service along Security and Fraud Dept. I gave them my personal info SS #, DOB, address and they did not have me in there records.. 
I called XXXX, XXXX  and XXXX I ordered my credit report and XXXX XXXX XXXXXXXX XXXX XXXX not on my credit report ... 
Nelson Cruz and Associate will not give me the bill from XXXX XXXX instead they want to settle for {$4000.00} over the phone, They continue to harass me with threats, arrest, lawsuit, vehicle repossession, wage garnishments ect.. 
Here are the name and phone.. 

Nelson Cruz and Associate XXXX XXXX XXXX. XXXX, Tx XXXX phone XXXX or XXXX 
XXXX XXXX XXXX"
8018745,Credit reporting or other personal consumer reports,Credit reporting,Problem with a company's investigation into an existing problem,Their investigation did not fix an error on your report,"TRANSUNION INTERMEDIATE HOLDINGS, INC.",FL,Web,Yes,N/A,2023-12-18,review_credit_reporting_dispute,324,"I am writing to address a matter that has been pending since my initial contact via mail and subsequent complaints filed with the CFPB. Regrettably, despite the passage of several months, I have yet to receive the anticipated resolution from your department regarding the misleading and inaccurate entry on my credit report."
3739698,Credit card or prepaid card,General-purpose credit card or charge card,Trouble using your card,Can't use card to make purchases,CAPITAL ONE FINANCIAL CORPORATION,CA,Web,Yes,N/A,2020-07-10,manual_agent_review,1162,Around XX/XX/2020 i XXXX XXXX XXXX opened a credit card account online with capital one bank and capital one approved me for a secured credit card and which i was excited to start my credit over again so at that time i sent capital one my security deposit for XXXX online then i got a letter from capital one bank on the XX/XX/2020 telling me that they need to talk to me about possibly fruad so i contacted them about their concerns and i also corporated with capital one bank giving them all the identifying information needed to get the restriction lifted twice first time they ask me for identification card pge bill and social card and i sent those to them and they confirm they received those items but them they stated to me that could not clear my id cause it was to knew and to call them back in a week i did that patiently waiting on capital one in the mist of all this iam dealing with XXXX and needing to use the card so i can get my medicine because i dont have enough cause i put the money into this account i am so XXXX  and iam asking that they please lift this and pay for my medicine that is XXXX because i should never been put threw this XXXX
3727041,"Credit reporting, credit repair services, or other personal consumer reports",Credit reporting,Incorrect information on your report,Information belongs to someone else,"TRANSUNION INTERMEDIATE HOLDINGS, INC.",AR,Web,Yes,N/A,2020-07-02,manual_agent_review,433,"I decided to pull my credit because every single time I would apply for a credit card I would get denied. To the best of my knowledge I have always paid my bills on time. So, I know for a fact that these things showing on my report do not belong to me. These accounts were fraudulently made without my consent. Please remove these accounts from my report as soon as possible. XXXX {$3100.00} XXXX  XXXX {$1100.00} XXXX XXXX {$220.00}"
8070648,Debt collection,Credit card debt,False statements or representation,Attempted to collect wrong amount,Resurgent Capital Services L.P.,KY,Web,Yes,N/A,2023-12-28,escalate_for_manager_or_compliance_review,258,"XXXX 2021, amount of XXXX to collect is Not accurate on my credit report. 
*I had called the company was told I had a lawsuit on me to pay the debt and that amount is not right! 
* So the rep told me to email for correspondence an I have gotten no reply back"
3486993,"Money transfer, virtual currency, or money service",Mobile or digital wallet,Fraud or scam,,"Block, Inc.",FL,Web,Yes,N/A,2020-01-06,escalate_for_manager_or_compliance_review,1690,"According to Federal Law, XXXX is legal. I opened an online business. I used Square as my vehicle of payment. After 2 sales totaling {$950.00}, they deactivated my account saying it was a high risk business. I understand, XXXX is still misunderstood, but it helps millions of people deal with pain & anxiety. So I am passionate about helping people feel better. If Square doesn't understand that it is legal, that it is NOT trying to hurt the public ( quite the opposite ) & they consider it high risk, fine. But don't keep my money for 3 months with NO resolve ability. It is impossible to reach them. OH yes, sales you get a human. Anything involving a deactivated account, they tell you to look at the first email. I called their numbers ( 3 of them ) on 5 different occasions over the past 2 months, all lead you to nowhere but frustration. That email tells you to go to their help online. Help online tells you to go to the email. 
Contacted the sales rep I bought it from on XX/XX/XXXX. When deactivated, I sent him an email on XX/XX/XXXX. No response. I called him on XX/XX/10, XXXX. No call back. I am beyond words. 

On XX/XX/XXXX, XXXX XXXX attempted to transfer to my XXXX XXXX account. On"
8226922,Credit reporting or other personal consumer reports,Credit reporting,Problem with a company's investigation into an existing problem,Their investigation did not fix an error on your report,Experian Information Solutions Inc.,GA,Web,Yes,N/A,2024-01-26,review_credit_reporting_dispute,2776,"I trust this letter finds you well. I am writing to bring to your attention a matter of extreme concern and frustration regarding the persistent issues I have faced in correcting a late open account and the associated late closed and charge-off status on my financial records.

Despite my repeated attempts to address and rectify these issues over the past several months, the challenges persist, negatively impacting my creditworthiness and causing significant stress. I am seeking your immediate attention and resolution to this matter.

Here is a summary of the steps I have taken to address these issues : Despite my continued efforts, the late open account has not been corrected, and the associated late closed and charge-off status remains on my records.

I understand that resolving such matters may take time, but the prolonged nature of this issue has led me to escalate the situation formally. I kindly request a thorough and expedited investigation into the root causes of these problems and the implementation of corrective measures to rectify the late open account and remove the late closed and charge-off status promptly. 

If there are specific documents or information required from"
3242075,"Credit reporting, credit repair services, or other personal consumer reports",Credit reporting,Problem with a credit reporting company's investigation into an existing problem,Their investigation did not fix an error on your report,"TRANSUNION INTERMEDIATE HOLDINGS, INC.",TX,Web,Yes,N/A,2019-05-14,review_credit_reporting_dispute,406,XXXX and Transunion are reporting incorrectly that I am 60 120 days past due on the SECURITY partial account numbers XXXX. This account reports a {$0.00} balance and {$0.00} past due. ( Please see pages 14 17 of the attached credit report. ) This incorrect reporting is harming my credit score. Please keep in mind that it is impossible to be late on accounts where nothing is owed and nothing is past due.
3401796,Debt collection,Mortgage debt,Communication tactics,"You told them to stop contacting you, but they keep trying","SELECT PORTFOLIO SERVICING, INC.",VA,Web,Yes,N/A,2019-10-10,escalate_for_manager_or_compliance_review,737,"SPS Select Portfolio Servicing of XXXX XXXX XXXX, UT appears to be a debt collection agency, who started a systematic harassment by mail debt collection campaign against wife, XXXX XXXX. 

This harassment following a failed foreclosure attempt over the past 2 years ( XXXX-XXXX ) by XXXX XXXX XXXX and their attorneys ( XXXX ) over a 2nd Mortgage default loan by XXXX, approximately 10 Years ago. 

During XXXX-XXXX time period of XXXX/XXXX ( attempt to foreclose on our residence, XXXX XXXX XXXX, XXXX, VA XXXX, on legal advice & assistance of Mr. XXXX XXXX, Attorney, XXXX XXXX, VA, both myself, XXXX XXXX, and wife, XXXX, entered Chapter XXXX Trustee Protection, twice, that prevented the foreclosure attempt by XXXX/XXXX legal agent."
3358661,"Credit reporting, credit repair services, or other personal consumer reports",Credit reporting,Problem with a credit reporting company's investigation into an existing problem,Their investigation did not fix an error on your report,"MARINER FINANCE, LLC",MS,Web,Yes,N/A,2019-08-29,escalate_for_manager_or_compliance_review,2342,"On XX/XX/XXXX, I received a personal loan from the XXXX XXXX, XXXX branch of XXXX XXXX XXXX. On XX/XX/XXXX, my wife and I filed Chapter XXXX Bankruptcy which included that loan. The bankruptcy was completed on XX/XX/XXXX, and the loan is being properly listed on my credit report as Chapter XXXX Bankruptcy. 

However there is another loan listed on my credit report under Mariner Finance. It was also reportedly issued on XX/XX/XXXX, with a last payment made date of XX/XX/XXXX, the exact dates reported by XXXX XXXX XXXX. This loan is being reported as Unpaid Balance Charged Off. I have never applied for or received a loan from Mariner Finance, and certainly did not apply for or receive two entirely different loans on XX/XX/XXXX, as is currently claimed on my credit report. 

In XX/XX/XXXX, XXXX XXXX XXXX merged with Mariner Finance , LLC and on XX/XX/XXXX, the company became known as Mariner Finance. It appears that sometime between the merger and the final discharge of the debt, the account was transferred from XXXX XXXX XXXX to Mariner Finance, resulting in a new account number. That doesn't make it a new loan or change the fact it was XXXX, however. 

On XX/XX/XXXX, I submitted an "
3221245,"Credit reporting, credit repair services, or other personal consumer reports",Credit reporting,Problem with a credit reporting company's investigation into an existing problem,Their investigation did not fix an error on your report,Experian Information Solutions Inc.,OK,Web,Yes,N/A,2019-04-24,review_credit_reporting_dispute,253,XXXX  ; Experian and XXXX are reporting duplicate entries on my credit report for the XXXX partial account number XXXX in the amount of {$2700.00}. ( Please see page 2 of the attached credit report. ) This incorrect reporting is harming my credit score.
3063440,"Payday loan, title loan, or personal loan",Payday loan,Problem with a credit reporting company's investigation into an existing problem,Their investigation did not fix an error on your report,Ad Astra Recovery Services Inc,TX,Web,Yes,N/A,2018-11-01,escalate_for_manager_or_compliance_review,845,"On XX/XX/18, I filed a complaint with Consumer Finance Protection Bureau ; XXXX ( complaint number ), regarding "" Ad Astra Recovery Service '', falsifying information on my credit report that they never "" Validated '' as belonging to me. In their response to the Consumer Finance Protection Bureau, on XX/XX/18 ; Ad Astra Recovery Service, stated they requested to the bureaus to delete from my credit report. They  never deleted this account from my XXXX credit report. This continue to be a "" Fraudulent '' company. I have attached the XXXX  report showing they are telling XXXX to keep this false information on my credit report illegally, according to the "" Fair Debt Collections Practices Act ''. I am requesting to have this information forwarded to "" the Attorney General 's Office, and to forward to Federal Trade Commission immediately."
7988956,Credit reporting or other personal consumer reports,Credit reporting,Problem with a company's investigation into an existing problem,Investigation took more than 30 days,"EQUIFAX, INC.",TX,Web,Yes,N/A,2023-12-12,review_credit_reporting_dispute,256,I have been trying to dispute incorrect and/or invalid items listed on my credit report and have gotten no assistance from the creditors or the credit bureaus regarding this matter. Please see attached documents and letter for referenced issues from above.
