complaint_id,product,sub_product,issue,sub_issue,company,channel,state,timely_response,consumer_disputed,reason_code,matched_phrase,sentence_snippet,narrative_preview,narrative_length
8113747,Credit reporting or other personal consumer reports,Credit reporting,Incorrect information on your report,Information belongs to someone else,Experian Information Solutions Inc.,Web,IL,Yes,N/A,legal_or_fraud_language,fraudulent,I assert that this account is not mine and believe it to be fraudulent.,Kindly address this issue on my credit report. I assert that this account is not mine and believe it to be fraudulent. I urge you to correct this mistake and have provided supporting documents for verification.,210
3573294,"Credit reporting, credit repair services, or other personal consumer reports",Credit reporting,Incorrect information on your report,Information belongs to someone else,"EQUIFAX, INC.",Web,NC,Yes,N/A,legal_or_fraud_language,FTC,I have already filed a FTC Report and Police Report.,"I wrote three requests, the unverified accounts listed below still remain on my credit report in violation of Federal Law. Equifax is under FCRA law to obtain the of the original creditors documentation on file to verify that this information is mine and is correct. I have already filed a FTC Report and Police Report. Who verified these accounts? You have NOT provided me a copy of ANY original documentation ( a consumer contract with my signature on it ) as required under Section 609 ( a ) ( 1 ) ( A ) & Section 611 ( a ) ( 1 ) ( A ). Furthermore you have failed to provide the method of verification as required under Section 611 ( a ) ( 7 ). Please be advised that under Section 611 ( 5 ) ( A ) of the FCRA you are required to promptly DELETE all information which can not be verified. 
The law is very clear as to the Civil liability and the remedy available to me ( Section 616 & 617 ) if yo",1139
7970275,Credit reporting or other personal consumer reports,Credit reporting,Incorrect information on your report,Account status incorrect,Experian Information Solutions Inc.,Web,PA,Yes,N/A,legal_or_fraud_language,fraud,Code 1681b Permissible purposes of consumer reports I never gave any written consent to report anything on my consumer reports no consent is fraud.,This is XXXX XXXX do not deny my complaint by stating that I filed this by some other means than myself.This is done 100 % by me. The stuff on my credit report is wrong and Under 15 U.S. Code 1681b Permissible purposes of consumer reports I never gave any written consent to report anything on my consumer reports no consent is fraud.,334
3597714,"Credit reporting, credit repair services, or other personal consumer reports",Credit reporting,Problem with a credit reporting company's investigation into an existing problem,Their investigation did not fix an error on your report,Experian Information Solutions Inc.,Web,TX,Yes,N/A,legal_or_fraud_language,fraud,Experian created what they called an investigation which lead to the incorrect/fraud info to remain on my report after they deleted this same info by another collection agency previously.,"I notified Experian of an inaccuracy on my report by national credit adjust. This same account was reported to Experian by another company, XXXX XXXX XXXX XXXX which was deleted on XX/XX/2019 because it was proven invalid. Experian created what they called an investigation which lead to the incorrect/fraud info to remain on my report after they deleted this same info by another collection agency previously. This information is completely false and should not remain on my credit. Please help!",496
3300820,Credit card or prepaid card,Store credit card,Problem with a purchase shown on your statement,Card was charged for something you did not purchase with the card,Nelson Cruz & Associates LLC,Web,TN,Yes,N/A,legal_or_fraud_language,Fraud,On XX/XX/XXXX I called XXXX XXXX XXXX XXXX and spoke in someone in customer service along Security and Fraud Dept.,"On XX/XX/XXXX I was called by a creditor Nelson Cruz and Associate they claimed I owed XXXX XXXX XXXX XXXX {$12000.00} from XXXX thru XXXX ... I never had a credit card with XXXX or applied for credit with them ... On XX/XX/XXXX I called XXXX XXXX XXXX XXXX and spoke in someone in customer service along Security and Fraud Dept. I gave them my personal info SS #, DOB, address and they did not have me in there records.. 
I called XXXX, XXXX  and XXXX I ordered my credit report and XXXX XXXX XXXXXXXX XXXX XXXX not on my credit report ... 
Nelson Cruz and Associate will not give me the bill from XXXX XXXX instead they want to settle for {$4000.00} over the phone, They continue to harass me with threats, arrest, lawsuit, vehicle repossession, wage garnishments ect.. 
Here are the name and phone.. 

Nelson Cruz and Associate XXXX XXXX XXXX. XXXX, Tx XXXX phone XXXX or XXXX 
XXXX XXXX XXXX",895
8070648,Debt collection,Credit card debt,False statements or representation,Attempted to collect wrong amount,Resurgent Capital Services L.P.,Web,KY,Yes,N/A,legal_or_fraud_language,lawsuit,*I had called the company was told I had a lawsuit on me to pay the debt and that amount is not right!,"XXXX 2021, amount of XXXX to collect is Not accurate on my credit report. 
*I had called the company was told I had a lawsuit on me to pay the debt and that amount is not right! 
* So the rep told me to email for correspondence an I have gotten no reply back",258
3486993,"Money transfer, virtual currency, or money service",Mobile or digital wallet,Fraud or scam,,"Block, Inc.",Web,FL,Yes,N/A,legal_or_fraud_language,legal,"According to Federal Law, XXXX is legal.","According to Federal Law, XXXX is legal. I opened an online business. I used Square as my vehicle of payment. After 2 sales totaling {$950.00}, they deactivated my account saying it was a high risk business. I understand, XXXX is still misunderstood, but it helps millions of people deal with pain & anxiety. So I am passionate about helping people feel better. If Square doesn't understand that it is legal, that it is NOT trying to hurt the public ( quite the opposite ) & they consider it high risk, fine. But don't keep my money for 3 months with NO resolve ability. It is impossible to reach them. OH yes, sales you get a human. Anything involving a deactivated account, they tell you to look at the first email. I called their numbers ( 3 of them ) on 5 different occasions over the past 2 months, all lead you to nowhere but frustration. That email tells you to go to their help online. Help o",1690
3401796,Debt collection,Mortgage debt,Communication tactics,"You told them to stop contacting you, but they keep trying","SELECT PORTFOLIO SERVICING, INC.",Web,VA,Yes,N/A,legal_or_fraud_language,legal,"During XXXX-XXXX time period of XXXX/XXXX ( attempt to foreclose on our residence, XXXX XXXX XXXX, XXXX, VA XXXX, on legal advice & assistance of Mr.","SPS Select Portfolio Servicing of XXXX XXXX XXXX, UT appears to be a debt collection agency, who started a systematic harassment by mail debt collection campaign against wife, XXXX XXXX. 

This harassment following a failed foreclosure attempt over the past 2 years ( XXXX-XXXX ) by XXXX XXXX XXXX and their attorneys ( XXXX ) over a 2nd Mortgage default loan by XXXX, approximately 10 Years ago. 

During XXXX-XXXX time period of XXXX/XXXX ( attempt to foreclose on our residence, XXXX XXXX XXXX, XXXX, VA XXXX, on legal advice & assistance of Mr. XXXX XXXX, Attorney, XXXX XXXX, VA, both myself, XXXX XXXX, and wife, XXXX, entered Chapter XXXX Trustee Protection, twice, that prevented the foreclosure attempt by XXXX/XXXX legal agent.",737
3358661,"Credit reporting, credit repair services, or other personal consumer reports",Credit reporting,Problem with a credit reporting company's investigation into an existing problem,Their investigation did not fix an error on your report,"MARINER FINANCE, LLC",Web,MS,Yes,N/A,legal_or_fraud_language,attorney,He suggested we contact an attorney if we had further questions.,"On XX/XX/XXXX, I received a personal loan from the XXXX XXXX, XXXX branch of XXXX XXXX XXXX. On XX/XX/XXXX, my wife and I filed Chapter XXXX Bankruptcy which included that loan. The bankruptcy was completed on XX/XX/XXXX, and the loan is being properly listed on my credit report as Chapter XXXX Bankruptcy. 

However there is another loan listed on my credit report under Mariner Finance. It was also reportedly issued on XX/XX/XXXX, with a last payment made date of XX/XX/XXXX, the exact dates reported by XXXX XXXX XXXX. This loan is being reported as Unpaid Balance Charged Off. I have never applied for or received a loan from Mariner Finance, and certainly did not apply for or receive two entirely different loans on XX/XX/XXXX, as is currently claimed on my credit report. 

In XX/XX/XXXX, XXXX XXXX XXXX merged with Mariner Finance , LLC and on XX/XX/XXXX, the company became known as Marine",2342
3063440,"Payday loan, title loan, or personal loan",Payday loan,Problem with a credit reporting company's investigation into an existing problem,Their investigation did not fix an error on your report,Ad Astra Recovery Services Inc,Web,TX,Yes,N/A,legal_or_fraud_language,Fraudulent,"This continue to be a "" Fraudulent '' company.","On XX/XX/18, I filed a complaint with Consumer Finance Protection Bureau ; XXXX ( complaint number ), regarding "" Ad Astra Recovery Service '', falsifying information on my credit report that they never "" Validated '' as belonging to me. In their response to the Consumer Finance Protection Bureau, on XX/XX/18 ; Ad Astra Recovery Service, stated they requested to the bureaus to delete from my credit report. They  never deleted this account from my XXXX credit report. This continue to be a "" Fraudulent '' company. I have attached the XXXX  report showing they are telling XXXX to keep this false information on my credit report illegally, according to the "" Fair Debt Collections Practices Act ''. I am requesting to have this information forwarded to "" the Attorney General 's Office, and to forward to Federal Trade Commission immediately.",845
3424418,"Credit reporting, credit repair services, or other personal consumer reports",Credit reporting,Incorrect information on your report,Information belongs to someone else,Experian Information Solutions Inc.,Web,GA,Yes,N/A,legal_or_fraud_language,fraudulent,I also ask them to remove these fraudulent accounts reporting in my consumer file that do not belong to me.,"I have contacted this bureau multiple times requesting an investigation to verify the debt and ask who opened and signed for these accounts. I also ask them to remove these fraudulent accounts reporting in my consumer file that do not belong to me. They have not mailed me any results and have yet to contact me regarding this matter. They are not cooperating with me at all. The accounts listed below were opened in result of identity theft. It is hindering me from obtaining credit and I need this removed asap. The accounts are listed here below. XXXX   XXXX XXXX : XXXX XXXX XXXX XXXX XXXX XXXX XXXX XXXX ( XXXX, XXXX ) XXXX/XXXX : XXXX XXXX/XXXX : XXXX XXXX XXXX/XXXX : XXXX XXXX/XXXX XXXX XXXX XXXX XXXX XXXX : XXXX XXXX XXXX/XXXX XXXX : XXXX XXXX : XXXX Dept of ED : XXXX ( XXXX ), ( XXXX ), ( XXXX ), ( XXXX ), ( XXXX ) Bankruptcy XXXX XXXX XXXX : XXXX XXXX  : XXXX XXXX/XXXX XXXX Dept of Ed ",1004
3220066,Debt collection,Payday loan debt,Attempts to collect debt not owed,Debt was result of identity theft,"National Credit Adjusters, LLC",Web,TX,Yes,N/A,legal_or_fraud_language,ftc,National credit adjusters after giving then police reports and ftc identify theft report put a collection on my XXXX  report that legally needs to be removed.this is illegally on my XXXX credit report.,National credit adjusters after giving then police reports and ftc identify theft report put a collection on my XXXX  report that legally needs to be removed.this is illegally on my XXXX credit report. My ss # is XXXX.I have given proof of this to my attorney who has taken several companies to court on my behalf,313
8169505,Credit reporting or other personal consumer reports,Credit reporting,Incorrect information on your report,Information belongs to someone else,"TRANSUNION INTERMEDIATE HOLDINGS, INC.",Web,,Yes,N/A,legal_or_fraud_language,fraud,"Assuming no one cares either way, block the noteworthy of any information in my credit record that came about due to an alleged fraud or extortion.","This is my first endeavor to tell you that I am a victim of identity theft and I complain to question specific records in my document coming about because of the wrongdoing. The records I am questioning connect with no exchanges acquiring any possession of goods, services or money that I have made or authorized. Assuming no one cares either way, block the noteworthy of any information in my credit record that came about due to an alleged fraud or extortion. 
XXXX XXXXXXXX XXXX XXXX XXXX XXXX XXXX, FL XXXX XXXX XXXXXXXX XXXX XXXX XXXXXXXX, FL XXXX XXXXXXXX XXXX XXXX XXXX XXXX XXXX XXXXXXXX XXXX, FL XXXX XXXX XXXX XXXX, FL XXXX XXXX XXXX XXXX, FL XXXX XXXX XXXX XXXX XXXX XXXXXXXX, FL XXXX XXXX XXXX XXXXXXXX XXXX XXXX  FL XXXX XXXX XXXX XXXX XXXX XXXX XXXXXXXX XXXX, FL XXXX XXXX XXXX XXXX Balance Owed : {$0.00} XXXX XXXX XXXX Balance Owed : {$7400.00} XXXX XXXX XXXX XXXX XXXX Balance Owed :",1108
3115907,Mortgage,FHA mortgage,Closing on a mortgage,,Selene Finance LP,Web,GA,Yes,N/A,legal_or_fraud_language,attorney,I was told by the closing attorney that Selene Finance would send me a check for the excess money in my escrow account within 20 days of closing.,"I closed out my mortgage loan with Selene Finance when I sold my former house on XX/XX/2018. I was told by the closing attorney that Selene Finance would send me a check for the excess money in my escrow account within 20 days of closing. Selene Finance has confirmed that there was approximately {$4000.00} in my account but they have not sent it to me, despite numerous attempts to contact them.",397
8873634,Checking or savings account,Checking account,Problem with a lender or other company charging your account,Transaction was not authorized,CAPITAL ONE FINANCIAL CORPORATION,Web,MA,Yes,N/A,legal_or_fraud_language,fraudulent,"However on XX/XX/XXXX without my knowledge or consent, Capital One reversed 3 of those credits for the fraudulent charges for the amount of {$29.00} each, totaling {$89.00}.","On or about XX/XX/XXXX, I noticed there were at least 13 unauthorized charges on my checking account. These charges were made once per month dating back to at least XXXX of XXXX in the amount of {$29.00} each. The name of the vendor changed each month so it was difficult to detect and I did not recognize any of them. I then called Capital One to initiate a dispute. Capital One then gave me a provisional credit for each charge including interest. However on XX/XX/XXXX without my knowledge or consent, Capital One reversed 3 of those credits for the fraudulent charges for the amount of {$29.00} each, totaling {$89.00}. I did not not receive any explanation as to why these credits were reversed. These charges were fraudulent and not authorized by me so Capital One should refund the money. It is very concerning to have your money stolen not only by thieves but also by the bank itself. The cha",1082
3113946,"Credit reporting, credit repair services, or other personal consumer reports",Credit reporting,Problem with fraud alerts or security freezes,,CAPITAL ONE FINANCIAL CORPORATION,Web,GA,Yes,N/A,legal_or_fraud_language,fraud,"I just found out on XX/XX/2018, that someone tried to get another card from my account, even thought I have a fraud alert and I froze my account.","Four times this year, someone has been able to access my credit card account and change my address to get another credit card and 1 time in XXXX that tried to use it to get {$250.00} if the card. Even though I have a freeze on my account, and they are suppose to send a code to my phone to make any changes. 3 times it was for an address in XXXX and 1 time it was for an address in XXXX, XXXX, which I haven't lived in XXXX, XXXX in almost 9 years. I just found out on XX/XX/2018, that someone tried to get another card from my account, even thought I have a fraud alert and I froze my account. Everytime this happens it lowers my credit score. I have a XXXX credit score and I'm trying to buy a house. I don't want to close this account as it will lower my score even more. I have 7 credit cards and this is the only one that keeps getting hacked. I'm thinking now that it is an inside job. No matte",1215
3739701,Checking or savings account,Checking account,Managing an account,Deposits and withdrawals,NAVY FEDERAL CREDIT UNION,Web,NV,Yes,N/A,legal_or_fraud_language,fraudulent,So she pulls up our account and she says yes I see that your accounts has been frozen due to fraudulent activity and that you need to speak to our security department.,On XXXX XXXX around XXXX PST. My husband was standing inline outside of our bank ( Navy Federal Credit Union ) waiting to deposit a check he received from a vendor. He was holding the check in his hand along with a FedEx envelope that contain paperwork regarding our business. I was standing by the back bumper on the driver side of our car in the shade waiting for my husband to move closer in the bank. There was a lady in front of my husband that had a check in her hand and a gentleman behind him that had a check in his hand also. Outside the bank was a bank employee and he was directing the traffic flow to enter the bank due to the COVID-19. He asked the lady in front of my husband what was her business at the bank today was she her to for a transaction or to speak to a service member. She stated that she was her to cash a check. Then he asked my husband what was his business at the bank,14249
7942358,Credit card,General-purpose credit card or charge card,Problem with a purchase shown on your statement,Card was charged for something you did not purchase with the card,WELLS FARGO & COMPANY,Web,AZ,Yes,N/A,legal_or_fraud_language,fraudulent,"Cards not being sent to right address, fraudulent charges, etc.","I have been having ongoing problems with my credit cards at Wells Fargo. Cards not being sent to right address, fraudulent charges, etc. 

This past XXXX and XXXX, my card was charged for XXXX at XXXX, and then XXXX for XXXX, XXXX, and XXXX. I have had no luck contacting any of the businesses due to "" privacy concerns ''. I have filed a police report and have asked Wells Fargo to reopen the case.",399
3493072,"Money transfer, virtual currency, or money service",Domestic (US) money transfer,Other transaction problem,,"BANK OF AMERICA, NATIONAL ASSOCIATION",Web,MD,Yes,N/A,legal_or_fraud_language,fraud,"On XX/XX/2019, I was threatened to make a wire transfer in the amount of {$26000.00} from my bank account ( Bank : Bank of America ) to a fraud person claiming to be a social security agent.","On XX/XX/2019, I was threatened to make a wire transfer in the amount of {$26000.00} from my bank account ( Bank : Bank of America ) to a fraud person claiming to be a social security agent. I filed a claim with the bank but it did nothing to help me receive my money back. I also filed a police complaint but even the police put up their hands. The Police report # is the following : XXXX. I request to please help me with this matter. That honest, hard-earned money was going to be used for a significant life goal I was trying to accomplish. I would really appreciate any help I can get. The bank is inefficient at this point in doing anything.",647
3233732,"Credit reporting, credit repair services, or other personal consumer reports",Credit reporting,Problem with a credit reporting company's investigation into an existing problem,Difficulty submitting a dispute or getting information about a dispute over the phone,"TRANSUNION INTERMEDIATE HOLDINGS, INC.",Web,FL,Yes,N/A,legal_or_fraud_language,police report,Had a police report made and notified the the 3 Credit Bureaus.,"I had my identity stolen in XX/XX/XXXX. The thieves opened 2 credit line accounts with XXXX XXXX. I found out in XX/XX/XXXX. Had a police report made and notified the the 3 Credit Bureaus. All of them is such a difficult thing to get help. almost impossible. The websites aren't clear as to what to do. The numbers they provide are not right, as they are automated and no way to speak to a person. In special with XXXX, I filed a dispute, notified them of the identity theft back in XX/XX/XXXX, printed a report with the information and as of today, XX/XX/XXXX my credit is still showing the derogatory information. 
It is absurd what a person has to go through after being victimized by thieves. Something needs to be done about these companies. Trans Union is the same thing. I notified the 3 of the fraud, yet, I had to spend the day talking to them.",853
3545909,"Credit reporting, credit repair services, or other personal consumer reports",Credit reporting,Incorrect information on your report,Information belongs to someone else,"TRANSUNION INTERMEDIATE HOLDINGS, INC.",Web,PA,Yes,N/A,legal_or_fraud_language,fraudulent,I recently reviewed my credit profile and noticed inaccuracies and false accusations and fraudulent accounts.,I recently reviewed my credit profile and noticed inaccuracies and false accusations and fraudulent accounts.,109
3244458,Mortgage,Conventional home mortgage,Trouble during payment process,,"CARRINGTON MORTGAGE SERVICES, LLC",Web,NY,Yes,N/A,legal_or_fraud_language,attorney,My attorney did not receive the paperwork releasing the lien until XXXX of XXXX.,"This is in reference to COMPLAINT ID XXXX SUBMITTED ON XX/XX/XXXX Concerning Carrington 's  mismanagement of resolving mortgage assignments and recordings for a partial lien release. The closing for the property was to be XX/XX/XXXX. Because of the delay the buyer backed out of the sale of the vacant lot, {$35000.00}. My attorney did not receive the paperwork releasing the lien until XXXX of XXXX. XXXX XXXX",410
3692906,"Credit reporting, credit repair services, or other personal consumer reports",Credit reporting,Incorrect information on your report,Information belongs to someone else,"I.C. System, Inc.",Web,FL,Yes,N/A,legal_or_fraud_language,fraudulent,Either I am a victim of IDENTITY THEFT or I C System is fraudulently attempting to collect a balance that is NOT DUE.,"XXXX  Credit Monitoring notified me of I C System incorrectly reporting a {$700.00} collection account when I have never even heard of I C System. I have never received a single phone call or a single letter from I C System. This, of course, is in direct violation of the FCRA. 

I C System reports XXXX as the original creditor to XXXX. This is entirely FALSE. I have never once been late with my XXXX  account which has always been in GOOD STANDING. 

In fact, {$0.00} balance is due as the actual balance of only {$6.00} which was not due until XX/XX/20 has already been PAID IN FULL more than two weeks in advance. The next regular bill is NOT DUE UNTIL XX/XX/20. 

Either I am a victim of IDENTITY THEFT or I C System is fraudulently attempting to collect a balance that is NOT DUE. 

I called the number that XXXX  provided for I C System and no live person answers. A recorded message repeated",1319
8027980,Debt collection,I do not know,Electronic communications,"You told them to stop contacting you, but they keep trying",Imperial Finance Corp,Web,IN,Yes,N/A,legal_or_fraud_language,legal,"The website is highly suspicious and contains very little information, and only XXXX way to contact "" them '' by email at XXXX There also appears to be no legal business registration or location.","XXXX XXXX from Imperial Finance Corp has been attempting to contact me and my wife for a made-up debt of over {$55000.00}. I have been called, texted, and emailed repeatedly. 
XXXX of the emails had several other unknown personal email addresses copied. They are spamming random people over this. 

The website ( IMPERIALFINANCECORP.COM ) appears to have only existed since XX/XX/2023. The website is highly suspicious and contains very little information, and only XXXX way to contact "" them '' by email at XXXX There also appears to be no legal business registration or location. 

They are using many invasive tactics, calling and texting outside of normal business hours, repeatedly calling and have not stopped when asked to do so. 

The fact they are also calling my wife attempting to "" look for me '' is also concerning.",828
3728230,"Credit reporting, credit repair services, or other personal consumer reports",Credit reporting,Incorrect information on your report,Information belongs to someone else,Experian Information Solutions Inc.,Web,FL,Yes,N/A,legal_or_fraud_language,fraud,To whom it may concern ; I check my credit and notice some fraud accounts on my credit that I did not Authorize.,"To whom it may concern ; I check my credit and notice some fraud accounts on my credit that I did not Authorize. I have no Knowledge or have I open any of these Accounts This is fraud, and I want to put a fraud Alert on my credit so that this will not happen again.",265
